date,username,tweet
2022-10-05 12:21:14,jeslintuse2,Nusa Tenggara Timur Pemerintah Pastikan Semua Hotel Di Bali Siap Sambut KTT G20. #G20Indonesia #RecoverTogetherRecoverStronger #G20Indonesia2022 #GroupOfTwentyIndonesia  https://t.co/QAtdfL7sF0
2022-10-05 12:17:55,usharanimuni,Pemerintah pastikan hotel di Bali siap sambut KTT G20. Kepulauan Bangka Belitung  #G20Indonesia #RecoverTogetherRecoverStronger #G20Indonesia2022 #GroupOfTwentyIndonesia  https://t.co/siBpv8qWX5
2022-10-05 12:13:03,diaharmayanti1,Pemerintah pastikan hotel di bali siap sambut KTT G20  #G20Indonesia #RecoverTogetherRecoverStronger #G20Indonesia2022 #GroupOfTwentyIndonesia  https://t.co/QqFJhiMYOn
2022-10-05 12:12:31,SeptianiMestika,Bali Compendium akan dibawa Indonesia ke KTT G20 pada November mendatang sebagai salah satu deliverable di Presidensi G20 Indonesia - Arsjad Rasjid #b20 #arsjadrasjid #kompendiumbali #inklusifkolaboratif
2022-10-05 12:11:59,diaharmayanti1,Kesiapan jaringan telekomunikasi indonesia menghadapi KTT G20 Bali  #G20Indonesia #RecoverTogetherRecoverStronger #G20Indonesia2022 #GroupOfTwentyIndonesia  https://t.co/NDLwhQfXLA
2022-10-05 12:09:17,NovitaZara1,Bali Compendium akan dibawa Indonesia ke KTT G20 pada November mendatang sebagai salah satu deliverable di Presidensi G20 Indonesia - Arsjad Rasjid #b20 #arsjadrasjid #kompendiumbali #inklusifkolaboratif
2022-10-05 12:06:58,plat_mirah,"Mantap, pemerintah pastikan semua hotel di Bali siap menyambut delegasi KTT G20  🤗🤗🇲🇨🇲🇨 Kepulauan Bangka Belitung  #G20Indonesia #RecoverTogetherRecoverStronger #G20Indonesia2022 #GroupOfTwentyIndonesia  https://t.co/qOq2OwGpC6"
2022-10-05 12:02:57,verryprimatama1,Hotel di Bali siap Sambut KTT G20 !! #G20Indonesia #RecoverTogetherRecoverStronger #G20Indonesia2022 #GroupOfTwentyIndonesia Jawa Barat  https://t.co/BUAMyYTmOk
2022-10-05 12:02:16,CryptoKuta,"Menkominfo Johnny G. Plate : Kemkominfo telah menyiapkan Media Center KTT G20 dengan kapasitas untuk 1.500 orang.  “Media Center berlokasi di BICC,Hotel Westin,Nusa Dua Bali dan akan beroperasi mulai tanggal 13-17 November 2022”  @PlateJohnny @jokowi    https://t.co/IQ3apm7tH4"
2022-10-05 12:00:00,sadidawoaini,Pemerintah melalui Menparekraf Sandiaga Uno memastikan hotel di Bali siap untuk menyambut KTT G20  #G20Indonesia #RecoverTogetherRecoverStronger #G20Indonesia2022 #GroupOfTwentyIndonesia  https://t.co/QYEZ8J28Zi
2022-10-05 11:58:44,KekeCook2,Kesiapan jaringan telekomunikasi Indonesia menghadapi KTT G20 di Bali #G20Indonesia #RecoverTogetherRecoverStronger #G20Indonesia2022 #GroupOfTwentyIndonesia Jawa Barat  https://t.co/wQgxTtFt4u
2022-10-05 11:58:21,ErinNelson011,Menteri pariwisata dan ekonomi kreatif Sandiaga Uni memastikan persiapan hotel-hotel di Bali jelang puncak KTT G20 sudah sesuai jalur #G20Indonesia #RecoverTogetherRecoverStronger #G20Indonesia2022 #GroupOfTwentyIndonesia Jawa Barat  https://t.co/gDacZVubz0
2022-10-05 11:51:04,wiggins_eko,Pemerintah pastikan hotel di bali siap sambtu KTT G20 #G20Indonesia #RecoverTogetherRecoverStronger #G20Indonesia2022 #GroupOfTwentyIndonesia Jawa Barat  https://t.co/qREtQ81JeR
2022-10-05 11:50:28,DanangBarrera,Kesiapan jaringan telekomunikasi Indonesia menghadapi KTT G20 BALI   #G20Indonesia #RecoverTogetherRecoverStronger #G20Indonesia2022 #GroupOfTwentyIndonesia Jawa Barat  https://t.co/nh4PMMtjNm
2022-10-05 11:50:12,friska_diane,Pemerintah pstikan hotel di Bali sip sambut KTT G20  Daerah Istimewa Yogyakarta G20 Yogyakarta #G20Indonesia #RecoverTogetherRecoverStronger #G20Indonesia2022 #GroupOfTwentyIndonesia  https://t.co/tWnUhkWjJ7
2022-10-05 11:50:09,friska_diane,Kesiapan jaringan telekomunikasi Indonesia menghadapi KTT G20 Bali  Daerah Istimewa Yogyakarta G20 Yogyakarta #G20Indonesia #RecoverTogetherRecoverStronger #G20Indonesia2022 #GroupOfTwentyIndonesia  https://t.co/zatoRlXNwC
2022-10-05 11:44:31,Zyanpatra,"Perintah Luhut Pandjaitan di Bali Tegas, Ajak Pengemudi Lokal Terlibat di KTT G20  https://t.co/yahCLPkjee"
2022-10-05 11:41:58,Tahede55,Pemerintah pastikan Hotel di Bali siap sambuy KTT G20  INDONESIA SIAP JADI TUAN RUMAH G20  #G20Indonesia #RecoverTogetherRecoverStronger #G20Indonesia2022 Gorontalo  #GroupOfTwentyIndonesia  https://t.co/7Rh1L8aAh4
2022-10-05 11:40:05,jpnncom,"Perintah Menko Marves Luhut Pandjaitan di Bali tegas, ajak pengemudi lokal ikut memberi manfaatkan dengan terlibat di KTT G20 #LuhutPandjaitan  https://t.co/VotvtXpzWB"
2022-10-05 11:28:40,febipondo,Pemerintah Pastikan Hotel di Bali Siap Sambut KTT G20.   Nusa Tenggara Timur #G20Indonesia #RecoverTogetherRecoverStronger #G20Indonesia2022 #GroupOfTwentyIndonesia  https://t.co/IlQAk8kQYv
2022-10-05 11:21:56,amin_richmen,Berita Aceh - Jaringan telekomunikasi akan disiapkan untuk sambut KTT G20 di Bali  #G20Indonesia #RecoverTogetherRecoverStronger #G20Indonesia2022 #GroupOfTwentyIndonesia
2022-10-05 11:17:05,pak_jayaa,Update Aceh - Jaringan telekomunikasi akan disiapkan untuk sambut KTT G20 di Bali  #G20Indonesia #RecoverTogetherRecoverStronger #G20Indonesia2022 #GroupOfTwentyIndonesia  https://t.co/U1d6XzBxdY
2022-10-05 11:09:15,kurniayy,"Persiapan KTT G20, Menko Luhut Minta Sekolah dan Kantor di Bali WFH  https://t.co/OfIoFfascI  https://t.co/G2nsfBtqtk"
2022-10-05 11:00:01,WartaEkonomi,Menko Luhut Tinjau Venue Gelaran KTT G20 di Bali  https://t.co/ypWSJoJ9Bk
2022-10-05 10:59:11,faktualid_com,"Sandiaga Uno, Persiapan Bali Sambut 50.000 Delegasi dan Tamu KTT G20 Hampir Capai Titik Kulminasi #sandiagauno #G20Indonesia  https://t.co/io19yyMbd8"
2022-10-05 10:58:48,anastasyameira1,Kesiapan jaringan telekomunikasi Indonesia menghadapi KTT G20 Bali kami siap mendukung Nusa Tenggara Barat  #G20Indonesia #RecoverTogetherRecoverStronger #G20Indonesia2022 #GroupOfTwentyIndonesia  https://t.co/6X892yEhKc
2022-10-05 10:58:07,anastasyameira1,"Pemerintah pastikan hotel di Bali siap sambut KTT G20, Nusa Tenggara Barat  #G20Indonesia #RecoverTogetherRecoverStronger #G20Indonesia2022 #GroupOfTwentyIndonesia  https://t.co/OQla0R4C0y"
2022-10-05 10:56:52,voidotid,Kepala BNPB Letjen TNI Suharyanto memastikan kesiapan dalam menghadapi potensi bencana saat KTT G20 di Bali.  https://t.co/4nKlBDvsIf
2022-10-05 10:47:15,detikTravel,"Persiapan KTT G20, Menko Luhut Minta Sekolah dan Kantor di Bali WFH  https://t.co/8EnMGLTXa2"
2022-10-05 10:39:54,InfoPublikIP,"Menjelang Konferensi Tingkat Tinggi (KTT) G20 yang akan berlangsung di Bali pada 15 November 2022 mendatang, @kemkominfo terus meningkatkan kualitas jaringan telekomunikasi di lokasi acara. https://t.co/KQdcZj8ftv"
2022-10-05 10:38:06,InfoPublikIP,"Kunjungan ke Bali, Menko Marves Tinjau Venue KTT G20 Indonesia  https://t.co/n27GSj9IKb"
2022-10-05 10:27:16,nawacitadotco,Menkominfo: 1.337 Jurnalis Telah Mendaftar untuk Meliput KTT G20 di Bali  https://t.co/D2uUle5fZ7
2022-10-05 10:27:14,nawacitamedia,Menkominfo: 1.337 Jurnalis Telah Mendaftar untuk Meliput KTT G20 di Bali  https://t.co/FB1SBXJKHX
2022-10-05 10:27:11,NAWACIT4,Menkominfo: 1.337 Jurnalis Telah Mendaftar untuk Meliput KTT G20 di Bali  https://t.co/qqZBnwj4jX
2022-10-05 10:25:41,CEOfficialID,Luhut Perintahkan Sekolah dan Perkantoran di Bali Terapkan WFH Selama KTT G20  https://t.co/LnffqEOPJZ
2022-10-05 10:14:20,mwlorg_id,"Pertemuan tersebut menyaksikan pemilihan #LigaMuslimDunia untuk berpartisipasi dalam KTT Agama R20 yang pertama kalinya menjadi kelompok kerja partisipatif pada KTT G20, pada 2 &amp; 3 November di Bali, Indonesia, dengan partisipasi para pemimpin dalam dialog keagamaan &amp; intelektual.  https://t.co/0z5JCy1AfN"
2022-10-05 10:06:00,Salshab65173582,Pemerintah terus mematangkan persiapan rangkaian puncak acara KTT G20 yang dijadwalkan di Bali pada 15-16 November 2022.s #IndonesiaBergerakPulih TNI ADALAH KITA #MariBerinvestasidiIndonesia Dirgahayu TNI Army  https://t.co/Mp8PZ6tRJl
2022-10-05 09:40:40,jokowipejuangID,Pemerintah pastikan semua Hotel di Bali siap sambut KTT G20. Mulai dari hotel-hotel yang tersebar di Nusa Dua dan beberapa wilayah lainnya juga sudah siap menyambut KTT G20. Dan siap menyukseskan KTT G20.  Mandala Krida Jepang Kengerian di Pintu 13 #JokowiPresidenku #JokowiHebat  https://t.co/wz8cRaM8gn
2022-10-07 06:23:02,tauberitamedia,"Kemenkes terus mematangkan layanan kesehatan menjelang pelaksanaan Konferensi Tingkat Tinggi (KTT) G20 di Bali, November mendatang.   https://t.co/6qtCLcsVsV"
2022-10-07 06:09:36,nolantv_com,KTT G20 di Bali menjadi Ajang Promosi Produk UMKM ke Tingkat Dunia  https://t.co/BcRDTyi50g #Terbaru #ajang #bali #Berita
2022-10-07 06:06:06,tvOneNews,Kakorlantas Polri Pastikan Personel Siap Amankan Rute dan Perhelatan KTT G20 Bali  https://t.co/41RQgawRnM
2022-10-07 06:00:01,Nova8Chika,"Dalam menjelang acara KTT G20 di Bali , pemerintah melakukan persiapan dalam berbagai sektor  #OptimisEkonomiRIMenguat  #DukungIKNNusantara  https://t.co/aGKR6msyyA"
2022-10-07 06:00:00,AmarthaSefrian,Pemerintah memastikan kesiapan layanan kesehatan untuk peserta KTT G20 di Bali  #OptimisEkonomiRIMenguat #ProkesBoosterHarusSejalan  https://t.co/zlDlFvi2MQ
2022-10-07 05:17:51,syamsuladzic,KTT C20 capai kesepakatan soroti G20 yang masih terbelah - ANTARA News Bali  https://t.co/HBz0egacOp
2022-10-07 04:33:41,TabananHumas,Peran Humas Polda Bali Menjadi Ujung Tombak Informasi Pelaksanaan KTT G20 yang Presisi  Humas merupakan seksi atau organisasi yang berfungsi menjalin komunikasi dan kerjasama dengan publik serta pihak pihak terkait seperti media cetak maupun media online.Peran Humas Polda Bali  https://t.co/vN0rGJGqUt
2022-10-07 04:25:05,tauberitamedia,Presiden Jokowi meninjau sejumlah lokasi penunjang gelaran KTT G20 di Bali. Jokowi sebut semuanya sudah hampir siap   https://t.co/4k07GTmnNe
2022-10-07 03:31:54,SINDOnews,KTT G20 di Bali Jadi Ajang Promosi Produk UMKM ke Tingkat Dunia   #Sindonews #BukanBeritaBiasa . https://t.co/4eP6oGLy9x
2022-10-07 02:19:27,MpokMae,"Usai membuka WCCE ke-3 pada Kamis, 6 Oktober 2022, Presiden @jokowi meninjau pembangunan infrastruktur jalan di daerah Nusa Dua, Kabupaten Badung, Provinsi Bali yang akan dilalui oleh para pemimpin dunia yang menghadiri KTT G20 pada bulan November mendatang.  https://t.co/TzRnyp0NSS"
2022-10-07 02:18:54,GueTionghoa,"Usai membuka WCCE ke-3 pada Kamis, 6 Oktober 2022, Presiden @jokowi meninjau pembangunan infrastruktur jalan di daerah Nusa Dua, Kabupaten Badung, Provinsi Bali yang akan dilalui oleh para pemimpin dunia yang menghadiri KTT G20 pada bulan November mendatang.  https://t.co/ar9S0rKxxK"
2022-10-07 02:18:31,DivaCatrii,"Usai membuka WCCE ke-3 pada Kamis, 6 Oktober 2022, Presiden @jokowi meninjau pembangunan infrastruktur jalan di daerah Nusa Dua, Kabupaten Badung, Provinsi Bali yang akan dilalui oleh para pemimpin dunia yang menghadiri KTT G20 pada bulan November mendatang.  https://t.co/xbAsrtTOpV"
2022-10-07 00:21:04,buana_berita,"Jokowi Tinjau Tahura Ngurah Rai, Lokasi Perhelatan KTT G20 Bali 2022  https://t.co/5vMYXeJOGn"
2022-10-06 23:48:05,BJKT4Terpercaya,"Sobat BUMN, Green Energy Station (GES) @Pertamina siap melayani para delegasi KTT G20 di Bali pada November 2022   #EnergizingYou #GESPertaminaDukungG20 #PertaminaPimpinTransisiEnergi  https://t.co/CdPwp2i9WQ"
2022-10-06 23:28:51,BJKT1Terpercaya,Green Energy Station (GES)  @Pertamina  siap melayani para delegasi KTT G20 di Bali pada November 2022 untuk kebutuhan kendaraan kegiatan G20 yang sebagian besar menggunakan kendaraan listrik ramah lingkungan.  #EnergizingYou #GESPertaminaDukungG20 #PertaminaPimpinTransisiEnergi  https://t.co/uxETIkd2jj
2022-10-06 23:27:19,posmetro_padang,"Siap Sukseskan KTT G20, PLN Targetkan Relokasi PLTG Grati ke Bali Tuntas Akhir Oktober  https://t.co/dMMtMvrgJn"
2022-10-06 23:09:40,wanara79,Hutan Mangrove Bakal Jadi Venue KTT G20 di Bali  https://t.co/sAvDAsw44X
2022-10-06 23:09:38,HanjuangXyz,Hutan Mangrove Bakal Jadi Venue KTT G20 di Bali  https://t.co/77rkAynpmh
2022-10-06 23:04:46,mamavanenbas,"Usai membuka World Conference on Creative Economy ke-3 pada Kamis, 6 Oktober 2022, Presiden @jokowi meninjau pembangunan infrastruktur jalan di daerah Nusa Dua, Kab. Badung, Prov. Bali yang akan dilalui oleh para pemimpin dunia yang menghadiri KTT G20 pada bulan November  2022  https://t.co/DNvblxby6H"
2022-10-06 23:03:02,tauberitamedia,Tito hendak memastikan pembangunan TPST rampung sebelum Konferensi Tingkat Tinggi (KTT) G20 yang dilaksanakan di Bali -    https://t.co/83Vuhe5UC4
2022-10-05 09:38:32,tempodotco,Menko Luhut Binsar Pandjaitan menugaskan Pemprov Bali untuk mengurangi mobilisasi masyarakat selama KTT G20. #TempoBisnis  https://t.co/VcW6IiDiUH
2022-10-05 09:35:42,GNurhazrati,Indonesia selaku pemegang Presidensi G20 terus memantau perkembangan global termasuk situasi geopolitik jelang pelaksanaan KTT G20 yang akan digelar di Bali pada bulan November mendatang.  #onepiece1062  #cancer  5 Oktober  BTS ARMY  Gryffindor  Telkomsel  Run BTS  https://t.co/dJScwaAibV
2022-10-05 09:35:21,IdJurnalis,66 SPKLU Khusus Disiapkan untuk Sambut Delegasi KTT G20 di Bali  https://t.co/xmWyuAQZR7
2022-10-05 09:26:41,BumnPsrJitu,"Sobat BUMN, Green Energy Station (GES) @Pertamina siap melayani para delegasi KTT G20 di Bali pada November 2022 untuk kebutuhan  kegiatan G20 yang sebagian besar menggunakan kendaraan listrik ramah lingkungan.  #EnergizingYou #GESPertaminaDukungG20 #PertaminaPimpinTransisiEnergi  https://t.co/Udddf6HaDC"
2022-10-05 09:23:26,kalanganiseng,#G20INDONESIA Pemerintah Gunakan Mobil Listrik Untuk KTT G20 Bali  https://t.co/SSX8xqlie9 lewat @YouTube
2022-10-05 09:21:00,IDNdihatiku,Pemerintah pastikan semua Hotel di Bali siap sambut KTT G20. Mulai dari hotel-hotel yang tersebar di Nusa Dua dan beberapa wilayah lainnya juga sudah siap menyambut KTT G20. Dan siap menyukseskan KTT G20.  Mandala Krida Jepang Kengerian di Pintu 13 #JokowiPresidenku #JokowiHebat  https://t.co/CKWl7duIr9
2022-10-05 09:20:00,rakyatkuatt,Pemerintah pastikan semua Hotel di Bali siap sambut KTT G20. Mulai dari hotel-hotel yang tersebar di Nusa Dua dan beberapa wilayah lainnya juga sudah siap menyambut KTT G20. Dan siap menyukseskan KTT G20.  Mandala Krida Jepang Kengerian di Pintu 13 #JokowiPresidenku #JokowiHebat  https://t.co/fQatn9pmzA
2022-10-05 09:13:48,BUMN_SLWS_TEPAT,Green Energy Station (GES) @Pertamina siap melayani para delegasi KTT G20 di Bali pada November 2022 untuk kebutuhan kendaraan kegiatan G20 yang sebagian besar menggunakan kendaraan listrik ramah lingkungan. #EnergizingYou #GESPertaminaDukungG20 #PertaminaPimpinTransisiEnergi  https://t.co/8eZF9dvOCu
2022-10-05 09:08:11,WendyTangmar,"@CNNIndonesia Tragedi tambahan bagi negara ini, betapa primitifnya kita kalo seluruh dunia tau, sedangkan kita masih disuguhkan sinetron 42botol minuman.  Negara ketua G20 loh ini, mau taro di mana mukanya Pak @jokowi kalo di KTT Bali ditanyain kepala negara lain rame2...?"
2022-10-05 09:07:04,antarabiz,"Tinjau persiapan KTT G20 di Bali, Luhut: Sudah paten  https://t.co/DB2ic1wlpT"
2022-10-05 09:06:09,BUMN_Manado_Ayo,Pertamina siap layani delegasi KTT G20 di Bali pada November 2022 untuk kebutuhan kendaraan listrik di kegiatan G20. #GESPertaminaDukungG20  https://t.co/cC6syxrifm
2022-10-05 08:56:57,FaGtng,Telkomsel sudah menyiapkan kecepatan unduh 4G di beberapa wilayah di Bali mencapai 100 Mbps atau sekitar 4 kali lipat lebih cepat dari kecepatan unduh rata-rata nasional.  Semua bekerja untuk sukseskan acara puncak KTT G20.  @kemkominfo  @PlateJohnny  https://t.co/T3avZUYIHV
2022-10-05 08:52:20,Faktorutama,"Sandiaga Uno, Persiapan Bali Sambut 50.000 Delegasi dan Tamu KTT G20 Hampir Capai Titik Kulminasi -  https://t.co/oUxucXFGr8"
2022-10-05 08:42:13,antaranews,"Menteri Koordinator Bidang Kemaritiman dan Investasi Luhut Binsar Pandjaitan menilai persiapan KTT G20 Indonesia di Bali pada November 2022, mengalami kemajuan yang baik.   https://t.co/RkBnmj36lu"
2022-10-05 08:17:28,Gajah_Mada01,"Untuk mendukung pelaksanaan KTT G20 di Bali, Kominfo mendukung infrastruktur telekomunikasi melalui peningkatan kecepatan internet seluler 4G, fasilitasi perluasan jaringan 5G, penataan kabel udara, dan penyiapan jaringan backup @PlateJohnny  @kemkominfo   https://t.co/y94B0tOdnC"
2022-10-05 08:00:47,PtBerita,Menparekraf Pastikan Kesiapan Akomodasi Delegasi KTT G20 -  https://t.co/zUh8z5R1F9  https://t.co/JdresMa87g
2022-10-05 07:51:03,wahananewsdotco,"BMKG Pasang Layar Cuaca Antisipasi Gempa Menjelang KTT G20, Ini Lokasinya  https://t.co/GkJAYNEZIQ #Bali #KttG20 #Ktt #KttG20DiBali"
2022-10-05 07:29:48,sandiuno,"Dalam kunjungan kerja kemarin di Bali, kami @kemenparekraf mengadakan Rapat Koordinasi bersama @kemenkomarves mematangkan dan mempersiapkan secara teknis pelaksanaan Spouse Program KTT G20 pda 15-16 November 2022 yang dirancang khusus untuk 24 delegasi tingkat Kepala Negara.  https://t.co/FlIVjzQJcA"
2022-10-05 07:25:22,Marbot_Udien,"Kemenkominfo menyiapkan Media Center yang mampu menampung hingga 1.500 jurnalis peliput Konferensi Tingkat Tinggi (KTT) G20 di kawasan Bali International Convention Center (BICC), Nusa Dua, Provinsi Bali, pada 15-16 November 2022 mendatang. @PlateJohnny @kemkominfo"
2022-10-05 07:06:15,NoviRoose,Pemerintah Indoensia terus matangkan persiapan KTT G20 di Bali. #EkonomiRITetapMenguat  ..  https://t.co/fhRGoGtjbg
2022-10-06 23:01:18,mamavanenbas,"Presiden @jokowi meninjau sejumlah kesiapan fasilitas untuk mendukung perhelatan KTT G20 Bali 2022. Presiden berharap dari semua persiapan yang telah dilakukan, pelaksanaan KTT G20 Bali 2022 dapat berjalan lancar.  https://t.co/vQDkaBxFAU  https://t.co/yyGu3JT8A8"
2022-10-06 22:57:38,KartumerahNews,"Jelang KTT G20 di Bali, Mendagri Tito Karnavian Tinjau Pembangunan TPST Kesiman Kertalangu  https://t.co/RHX0yD37f7"
2022-10-06 22:50:50,BesongSatu,Presiden meninjau Tahura Ngurah Rai Bali yang akan menjadi salah satu tempat dilaksanakannya rangkaian perhelatan KTT G20 Bali 2022. Tahura Ngurah Rai akan menjadi sebuah tempat yg dapat memperlihatkan kepedulian Indonesia terhadap lingkungan kepada dunia.  https://t.co/Axbn3qcxAu  https://t.co/ZrfhkyeWJL
2022-10-06 22:48:39,Batman_Monyok,"Tinjau Tahura Ngurah Rai, Presiden: Ini Tunjukkan Kepedulian Indonesia terhadap Lingkungan  Presiden meninjau Tahura Ngurah Rai Bali yang akan menjadi salah satu tempat dilaksanakannya rangkaian perhelatan KTT G20 Bali 2022.  https://t.co/BXjlxsep4W  https://t.co/6ZS9sWIR5R"
2022-10-06 22:44:01,retnosetyow4t,"Presiden Joko Widodo meninjau sejumlah kesiapan fasilitas untuk mendukung perhelatan KTT G20 Bali 2022. Presiden berharap dari semua persiapan yang telah dilakukan, pelaksanaan KTT G20 Bali 2022 dapat berjalan lancar.  https://t.co/fsthj1WRSj"
2022-10-06 22:38:05,retnosetyow4t,"Usai membuka World Conference on Creative Economy ke-3 pd Kamis 6 Oktober 2022, Presiden Joko Widodo meninjau pembangunan infrastruktur jalan di daerah Nusa Dua, Kab.Badung Bali yang akan dilalui oleh para pemimpin dunia yang menghadiri KTT G20 pada bulan November mendatang  https://t.co/8Demi3hvE9"
2022-10-06 22:33:12,masakoyayam,Yuk kita dukung dan sukseskan penyelenggaraan KTT G20 Indonesia yang akan dilaksanakan di Bali 🎉
2022-10-06 22:20:03,hariankompas,"Presiden Joko Widodo meninjau persiapan penyelenggaraan KTT G20, Bali. Sebelumnya, para menteri Kabinet Indonesia Maju juga terlebih dahulu memantau persiapan acara. Persiapan tinggal 10 persen lagi. #Polhuk #AdadiKompas   https://t.co/KqD4Z16quK"
2022-10-06 22:19:58,humas_selbar,Peran Humas Polda Bali Menjadi Ujung Tombak Informasi Pelaksanaan KTT G20 yang Presisi  Humas merupakan seksi atau organisasi yang berfungsi menjalin komunikasi dan kerjasama dengan publik serta pihak pihak terkait seperti media cetak maupun media online.  https://t.co/jdhWoQ2OzR
2022-10-06 22:19:50,KompasData,"Presiden Joko Widodo meninjau persiapan penyelenggaraan KTT G20, Bali. Sebelumnya, para menteri Kabinet Indonesia Maju juga terlebih dahulu memantau persiapan acara. Persiapan tinggal 10 persen lagi. #Polhuk #AdadiKompas  https://t.co/EyT70OO2Nz"
2022-10-06 22:17:36,klikwarta_com,"Tinjau Persiapan Infrastruktur, Presiden Jokowi: Bali Siap Menyambut KTT G20  https://t.co/NgBYoMTOsb"
2022-10-06 22:10:59,kemenkomarves,"Tahukah Kamu? Tempat ini akan menjadi salah satu tempat dilaksanakannya rangkaian perhelatan KTT G20 Indonesia di Bali pada November 2022 nanti.   Menariknya lagi, Tahura ini sudah mengalami banyak perubahan dan persiapan demi menyongsong @Indonesia_G20.🇮🇩  https://t.co/fPrzBmITMz"
2022-10-06 22:02:35,NewMitrapol,"Tinjau persiapan infrastruktur, Presiden Jokowi: Bali siap sambut KTT G20  https://t.co/HGilA23yxZ"
2022-10-06 21:50:46,RianPertamax,"Persiapan Infrastruktur internet KTT G20 di Bali sudah 99,1 persen. Pulih lebih cepat Bangkit lebih kuat!  https://t.co/rYNfv8xgWd"
2022-10-06 21:47:27,MLindazahra,"Persiapan Infrastruktur internet KTT G20 di Bali sudah 99,1 persen. Pulih lebih cepat Bangkit lebih kuat!  https://t.co/RLFdpXJSJ1"
2022-10-06 21:47:01,KemenPU,"Menjelang Presidensi Indonesia pada KTT G20 November mendatang, Menteri PUPR Basuki Hadimuljono mendampingi Presiden @jokowi meninjau kesiapan sejumlah infrastruktur di Bali, Kamis (6/10), di antaranya Kawasan Mangrove Tahura Ngurah Rai dan Kawasan Garuda Wisnu Kencana (GWK).  https://t.co/HKOqWHkChQ"
2022-10-06 21:43:38,BJKT2Terpercaya,"Sobat BUMN, Green Energy Station (GES) @Pertamina siap melayani para delegasi KTT G20 di Bali pada November 2022 untuk kebutuhan kendaraan kegiatan G20 yang sebagian besar menggunakan kendaraan listrik ramah lingkungan.  https://t.co/oeH9eTRZIh"
2022-10-06 21:40:02,KompasEkonomi,"Jelang KTT G20 Bali, Simak Hal-hal Penting Berikut Ini  https://t.co/UDxALZdDCD"
2022-10-06 21:37:46,PostingnewsId,AHM siapkan 20 Skuter Listrik buat KTT G20   PT Astra Honda Motor menyerahkan 20 unit Honda PCX Electric kepada Dinas Perhubungan Provinsi Bali sebagai kendaraan operasional petugas selama persiapan hingga penyelenggaraan Konferens… https://t.co/VEj2DhXKeC  https://t.co/U18Ufxvl6a
2022-10-06 21:37:27,Deje_Vendra,"Presiden Jokowi tinjau sejumlah kesiapan fasilitas pendukung perhelatan KTT G20 Bali 2022, dan menyebut Tahura Ngurah Rai tunjukkan Kepedulian Indonesia thdp Lingkungan. Presiden berharap dari semua persiapan yg telah dilakukan, pelaksanaan KTT G20 Bali 2022 dapat berjalan lancar  https://t.co/GfZTwdtiRl"
2022-10-06 21:26:42,Deje_Vendra,"Usai membuka World Conference on Creative Economy (WCCE) ke-3 pada Kamis, 6 Oktober 2022, Presiden Jokowi meninjau pembangunan infrastruktur jalan di daerah Nusa Dua, Kabupaten Badung, Provinsi Bali yg akan dilalui para pemimpin dunia yg menghadiri KTT G20 November mendatang.  https://t.co/3nXcmJe4mJ"
2022-10-06 21:18:03,humaspolsektbn,Peran Humas Polda Bali Menjadi Ujung Tombak Informasi Pelaksanaan KTT G20 yang Presisi  https://t.co/amy8pN5mEp
2022-10-06 21:10:50,bnewsnet,Peran Humas Polda Bali Menjadi Ujung Tombak Informasi Pelaksanaan KTT G20 yang Presisi  https://t.co/HQY3ikwzWf
2022-10-06 21:08:53,ahimcakep,Tinjau Tahura Ngurah Rai Presiden: Ini Tunjukkan Kepedulian  Indonesia terhadap Lingkungan &amp; meninjau Sejumlah kesiapan fasilitas utk mendukung perhelatan KTT G20 Bali 2022. Pelaksanaan KTT G20 Bali 2022 dpt berjalan lancar  https://t.co/DlQiYB7aLx
2022-10-06 21:08:23,bnewsnet,I've just posted a new blog: Peran Humas Polda Bali Menjadi Ujung Tombak Informasi Pelaksanaan KTT G20 yang Presisi  https://t.co/EF6w5yClOS
2022-10-06 21:07:42,delapanenamcom,Peran Humas Polda Bali Menjadi Ujung Tombak Informasi Pelaksanaan KTT G20 yang Presisi  https://t.co/Zx45cEAvYq
2022-10-06 21:07:31,RianPertamax,"Persiapan Infrastruktur internet KTT G20 di Bali sudah 99,1 persen. Pulih lebih cepat Bangkit lebih kuat!  https://t.co/AipzXRZdct"
2022-10-06 21:04:40,jagabalicom,Peran Humas Polda Bali Menjadi Ujung Tombak Informasi Pelaksanaan KTT G20 yang Presisi  https://t.co/VIp3c2BH2j
2022-10-06 21:04:29,bnewsnet,I've just posted a new blog: Peran Humas Polda Bali Menjadi Ujung Tombak Informasi Pelaksanaan KTT G20 yang Presisi  https://t.co/2Fq3XJmTQC
2022-10-06 21:04:08,NewsCendana,Peran Humas Polda Bali Menjadi Ujung Tombak Informasi Pelaksanaan KTT G20 yang Presisi  https://t.co/s7zDpMLXW1
2022-10-06 21:03:57,rakyatnusantar4,Peran Humas Polda Bali Menjadi Ujung Tombak Informasi Pelaksanaan KTT G20 yang Presisi  https://t.co/I2IfDaYskS
2022-10-06 21:03:56,delapanenamcom,New blog post!!! Peran Humas Polda Bali Menjadi Ujung Tombak Informasi Pelaksanaan KTT G20 yang Presisi  https://t.co/PB5U1CS2eB
2022-10-06 21:03:49,MLindazahra,"Persiapan Infrastruktur internet KTT G20 di Bali sudah 99,1 persen. Pulih lebih cepat Bangkit lebih kuat!  https://t.co/hdUpj79dYN"
2022-10-06 21:03:49,lintasbatasnews,Peran Humas Polda Bali Menjadi Ujung Tombak Informasi Pelaksanaan KTT G20 yang Presisi  https://t.co/94nLsfYp54
2022-10-06 21:01:08,ketiklagi,Peran Humas Polda Bali Menjadi Ujung Tombak Informasi Pelaksanaan KTT G20 yang Presisi  https://t.co/Irnx5K0I0q
2022-10-06 21:00:59,bnewsnet,Peran Humas Polda Bali Menjadi Ujung Tombak Informasi Pelaksanaan KTT G20 yang Presisi  https://t.co/0FcD7LguUK
2022-10-06 20:56:26,ketiklagi,Peran Humas Polda Bali Menjadi Ujung Tombak Informasi Pelaksanaan KTT G20 yang Presisi  https://t.co/cFHEDqSFmf
2022-10-06 20:56:24,kabarlensa2021,Peran Humas Polda Bali Menjadi Ujung Tombak Informasi Pelaksanaan KTT G20 yang Presisi  https://t.co/GtvmdHB4Q3
2022-10-05 07:05:58,nvroost,Pemerintah Indoensia terus matangkan persiapan KTT G20 di Bali. #EkonomiRITetapMenguat  https://t.co/S9eY4wolHZ
2022-10-05 06:51:09,tempodotco,Sandiaga Siapkan 23 Hotel untuk Delegasi KTT G20 di Bali  https://t.co/iOj3MxZjjR #TempoBisnis
2022-10-05 06:48:58,Cah_Beler,"@hyang_wisnu @PlateJohnny @kemkominfo Untuk mendukung keberhasilan pelaksanaan KTT G20 di Bali, Kemenkominfo mendukung infrastruktur telekomunikasi melalui peningkatan kecepatan internet seluler 4G, memfasilitasi perluasan jaringan 5G, penataan kabel udara, serta penyiapan jaringan cadangan. @PlateJohnny @kemkominfo"
