date,username,tweet
2022-10-03 15:29:08,IntanAyuArimbi,Terminal VVIP bandara I Gusti Ngurah Rai telah siap menerima tamu KTT G20 di Bali.  https://t.co/05DeO0e2Qy
2022-10-03 15:04:03,PtBerita,"Jelang KTT G20, Polsek Ubud Patroli Masif ke Objek Wisata -  https://t.co/dxCafjCiEY  https://t.co/1XeSo98hNk"
2022-10-06 06:00:01,Syahputragaluh1,Pemerintah terus meningkatkan persiapan pada KTT G20 di Bali #SukseskanPembangunanNKRI #UtangTerkendali  https://t.co/09PFa4R0ku
2022-10-06 06:00:01,sodahappy32,Pemerintah mengantisipasi gangguan jaringan telekomunikasi di KTT G20 di Bali.  #SukseskanPembangunanNKRI #IKNSemangatBaruIndonesia  https://t.co/GGlckDl7w9
2022-10-06 06:00:01,juniriza28,"Pemerintah Antisipasi Gangguan Jaringan Telekomunikasi di KTT G20 di Bali, Johnny G Plate mengatakan Kemkominfo bersama mitra penyelenggara telekomunikasi telah menyiapkan jaringan cadangan #SukseskanPembangunanNKRI #SukseskanVaksinBoosterKedua  https://t.co/vdKoVRTQHl"
2022-10-06 06:00:01,naresetya,Pemerintah sudah menyiapkan antisipasi adanya gangguan jaringan telekomunikasi pada ajang KTT G20 di Bali  #SukseskanPembangunanNKRI #KUHPuntukRakyat  https://t.co/uVSu283qrN
2022-10-06 06:00:00,Hutson93349947,Pemerintah telah mengantisipasi gangguan jaringan telekomunikasi di KTT G20 di Bali. #SukseskanPembangunanNKRI  https://t.co/XwXYDrAnPF
2022-10-06 06:00:00,biebie999,Pemerintah mengantisipasi gangguan jaringan telekomunikasi di KTT G20 di Bali. #SukseskanPembangunanNKRI #IKNSemangatBaruIndonesia  https://t.co/rJeOy2BWxx
2022-10-06 06:00:00,Daffyp7,Pemerintah Antisipasi Gangguan Jaringan Telekomunikasi di KTT G20 di Bali #SukseskanPembangunanNKRI #IKNDukungEkonomiHijau  👍  https://t.co/c3u0v9aDbg
2022-10-06 05:54:41,bathroomsiinger,@hyang_wisnu @PlateJohnny @jokowi @kemkominfo @Aryprasetyo85 @zhymme @miicies @delArdian_ @DS_yantie @Ddwie5 @Anana73322693 @03__nakula Mantap 👍 mari kita sama-sama dukung dan sukseskan KTT G20 Indonesia di Bali 🎉 @kemkominfo @PlateJohnny
2022-10-06 04:00:19,Baliportal_news,"Siap Sukseskan KTT G20, Ini Strategi PLN untuk Tingkatkan Keandalan Listrik di Bali  #G20 #KeandalanListrikdiBali #LuhutBinsarPandjaitan #PLN #StrategiPLN   https://t.co/nxvpurm5gf  https://t.co/B6xlrhFH75"
2022-10-06 02:59:01,Clstamtra,Kominfo Tingkatkan Kualitas Jaringan Telekomunikasi di Lokasi KTT G20 Bali  https://t.co/zAhBaXUXVY
2022-10-06 00:56:33,antaranews,KTT C20 di Bali desak pemimpin G20 adopsi rekomendasi masyarakat sipil  https://t.co/TwiuZJZUn1
2022-10-06 00:41:38,aksesdisini_com,Luhut Minta Bali Terapkan Sekolah Daring dan WFH Selama KTT G20  https://t.co/1pWiDUwdBE
2022-10-06 00:31:37,Zyanpatra,AHM Serahkan Puluhan PCX Electrik untuk Operasional KTT G20 di Bali  https://t.co/OMccXc66po
2022-10-06 00:31:02,jpnncom,AHM menyerahkan puluhan unit Honda PCX electrik kepada Dinas Perhubungan (Dishub) Bali sebagai kendaraan operasional KTT G20. #HondaPCXElectric  https://t.co/9faoTkxeIu
2022-10-06 00:00:52,MhmdAlissa,"Saya senang ikut mendirikan &amp; memimpin Kelompok Agama R20 dalam G20, bersama NU Indonesia. KTT Keagamaan R20 yang diadopsi secara resmi akan dimulai “untuk pertama kalinya” pada pertemuan Bali mendatang, mengandalkan sumbu terpentingnya: “Membangun jembatan antara Timur &amp; Barat.”  https://t.co/EmIwJ4Zesf"
2022-10-05 23:10:20,jawapos,Luhut Minta Bali Terapkan Sekolah Daring dan WFH Selama KTT G20  https://t.co/iNleYd6mq2
2022-10-05 22:52:04,PolantasID,Kakorlantas Polri Pastikan Personel Siap Kawal dan Amankan Rute dan Perhelatan Konferensi Tingkat Tinggi (KTT) G20 di Pulau Dewata Bali  https://t.co/KmaspRz7x5
2022-10-05 22:41:10,MachmerTanner,"KTT G20 Bali, Momentum Konversi Penggunaan Kendaraan BBM ke Kendaraan Listrik di Indonesia #G20Indonesia #RecoverTogetherRecoverStronger #G20Indonesia2022 #GroupOfTwentyIndonesia  https://t.co/8vo9g7AqPQ"
2022-10-05 22:15:26,PemkotaBogor,"7. PT Telkom pun memastikan penguatan jaringan telekomunikasi tersebut untuk menyukseskan penyelenggaraan KTT G20. “Pulau Bali telah terkoneksi dengan 5 submarine cable, 3 ke arah barat dan 2 ke arah timur.  https://t.co/BOlKA72CLy"
2022-10-05 22:14:18,PemkotaBogor,"6. Ketiga, menyediakan layanan mobile dgn coverage 100% 4G dn 5G di area Bali yg didukung 3.656 BTS 4G dn 24 BTS 5G. Keempat, mengamankn jaringan dgn menerapkn Next Generation Firewall dn Anti-DDOS utk memastikn kehandalan dn keamanan jaringan telekomunikasi selama event KTT G20."
2022-10-03 14:56:35,M3juahjuah,"Utk memastikan kesiapan Bali sbg tuan rumah, Presiden Joko Widodo akan meninjau langsung lokasi pelaksanaan pertemuan G20. Presiden jg ingin memastikan detail agenda pertemuan krn agenda KTT G20 berdekatan waktunya dengan pertemuan internasional lainnya yaitu KTT ASEAN dan APEC.  https://t.co/0CwcD6vLn3"
2022-10-03 14:55:51,M3juahjuah,"Selain itu, dalam rapat juga dibahas mengenai kesiapan di Bali juga detail sesi pada saat KTT G20 nanti. Menurut Airlangga, Indonesia berharap agar keseluruhan hasil pembahasan para pemimpin negara G20 bisa sederhana dan dirangkum dalam 34 paragraf.  @jokowi  https://t.co/zRIDkXU2J1"
2022-10-03 14:51:54,M3juahjuah,"Penyelenggaraan pertemuan puncak negara-negara G20 di Bali pada November 2022 makin dekat.  Untuk itu, Presiden Jokowi kembali memimpin rapat bersama jajaran kabinetnya untuk mematangkan berbagai persiapan KTT G20 di Istana Merdeka, Jakarta, pada Senin, 3 Oktober 2022.  https://t.co/ybiDcGXAMY"
2022-10-03 14:48:52,nkrijiwaraga,Mari kita dukung dan sukseskan pelaksanaan KTT G20 di Bali Sulawesi Utara #G20Indonesia #RecoverTogetherRecoverStronger #G20Indonesia2022 #GroupOfTwentyIndonesia #SulawesiUtara  https://t.co/fPzOvWRM5u
2022-10-03 14:27:02,tauberitamedia,Presiden Joko Widodo (Jokowi) memimpin rapat bersama jajaran kabinet untuk mematangkan persiapan Konferensi Tingkat Tinggi (KTT) G20 di Bali.  https://t.co/gBoOsxZD4U
2022-10-03 14:12:13,Ireng_Maulana45,"Untuk memastikan kesiapan Bali sebagai tuan rumah, Presiden @jokowi meninjau langsung lokasi pelaksanaan pertemuan G20. Presiden juga ingin memastikan detail agenda pertemuan karena agenda KTT G20 berdekatan waktunya dengan pertemuan internasional lainnya yaitu KTT ASEAN dan APEC  https://t.co/rtesseyZhO"
2022-10-03 14:12:08,Ireng_Maulana45,"Selain itu, dalam rapat juga dibahas mengenai kesiapan di Bali juga detail sesi pada saat KTT G20 nanti. Menurut Airlangga, Indonesia berharap agar keseluruhan hasil pembahasan para pemimpin negara G20 bisa sederhana dan dirangkum dalam 34 paragraf.  https://t.co/tTSJeqM8QQ"
2022-10-03 14:11:52,Ireng_Maulana45,"Presiden @jokowi Kembali Pimpin Rapat untuk Matangkan Persiapan KTT G20  Penyelenggaraan pertemuan puncak negara-negara G20 di Bali pada November 2022 makin dekat. Untuk itu, Presiden Joko Widodo kembali memimpin rapat bersama jajaran kabinetnya  https://t.co/rddAq9DOHj"
2022-10-03 14:01:53,yulitasaarii___,"Penyelenggaraan pertemuan puncak negara-negara G20 di Bali pada November 2022 makin dekat. Utk itu, Presiden Jokowi kembali memimpin rapat bersama jajaran kabinetnya utk mematangkan berbagai persiapan Konferensi Tingkat Tinggi (KTT) G20 di Istana Merdeka, pada Senin, 3 Okt 2022  https://t.co/vZXnTYRhrG"
2022-10-03 13:51:59,detikcom_bali,"KTT G20 Wadah Promosi Pariwisata Gratis, Sekda Bali: Optimis Pulih #G20Indonesia    https://t.co/k3QibQtuk9"
2022-10-03 12:59:00,pemprov_gtlo,"""Layanan Fasilitas Kesehatan Pada KTT G20""  Berbagai fasilitas kesehatan disiapkan bagi delegasi G20 di Bali, hotel utama tempat penyelenggaraan KTT G20  #G20Indonesia2022 #RecoverTogetherRecoverStronger #G20Indonesia  #G20Updates #LayananKesehatan  https://t.co/IWz0yjAOHm"
2022-10-03 12:27:38,TelkomAkses_,"Sobat, Telkom Akses ikut serta dalam proses persiapan kegiatan KTT G20 yang akan diselenggarakan bulan November 2022 di Bali.  Sebagai informasi, TA merupakan bagian dari satgas Telkom Group yang akan mengamankan jaringan telekomunikasi selama perhelatan KTT berlangsung.  https://t.co/fWsVJhciHI"
2022-10-03 12:21:40,jpnncom,#BeritaBali  BMKG Bersiap Skenario Terburuk Gempa 8.5 SR Guncang Bali Menjelang KTT G20 @infoBMKG  #skenarioterburuk  #gempabumi  #KTTG20  https://t.co/GSHG468VId
2022-10-03 12:15:03,detikcom_bali,"BMKG Antisipasi Ancaman Gempa Magnitudo 8,5 Jelang KTT G20 Bali  https://t.co/oA31KUUdvA"
2022-10-03 11:32:44,bumn_sby_santun,"Sobat BUMN, Green Energy Station (GES) @Pertamina siap melayani para delegasi KTT G20 di Bali pada November 2022 untuk kebutuhan kendaraan kegiatan G20 yang sebagian besar menggunakan kendaraan listrik ramah  #EnergizingYou #GESPertaminaDukungG20PertaminaPimpinTransisiEnergi  https://t.co/L9bLOtvrgd"
2022-10-03 11:02:40,detikcom_bali,"Jelang KTT G20, Polisi Razia Ratusan Kendaraan di Kawasan Sanur  https://t.co/3V6PCkt5p7"
2022-10-03 10:56:37,BTerampil,Green Energy Station (GES) @Pertamina siap melayani para delegasi KTT G20 di Bali pada November 2022 untuk kebutuhan kendaraan kegiatan G20 yang sebagian besar menggunakan kendaraan listrik ramah lingkungan.  #EnergizingYou #GESPertaminaDukungG20 #PertaminaPimpinTransisiEnergi  https://t.co/YocQWn8GAr
2022-10-03 10:39:20,BumnJambiJitu,Pertamina siap layani delegasi KTT G20 di Bali pada November 2022 untuk kebutuhan kendaraan listrik di kegiatan G20. #GESPertaminaDukungG20  https://t.co/NgLcXX0BRr
2022-10-03 09:07:24,rutanpasangkayu,"Hal tersebut disampaikannya saat menghadiri Tactical Floor Game (TFG) Pam KTT G20 yang dipimpin Panglima TNI Jenderal Andika Perkasa, bertempat di GOR Kepaon Bali."
2022-10-03 09:05:07,Portalnesia1,"Jelang KTT G20, Kementan Perkuat Pengendalian Rabies di Bali - Portalnesia #PN #PNnews   https://t.co/Pc6udLJG6e"
2022-10-03 09:02:14,Zyanpatra,BMKG Bersiap Skenario Terburuk Gempa 8.5 SR Guncang Bali Menjelang KTT G20  https://t.co/rCI3VwV9Pq
2022-10-03 09:00:05,jpnncom,BMKG bersiap dengan skenario terburuk terjadi bencana alam dengan gempa 8.5 SR yang mengguncang Bali menjelang KTT G20 #BMKG  https://t.co/GSHG46r4Wl
2022-10-03 08:15:36,wahananewsdotco,"BMKG Siapkan Antisipasi Gempa M 8,5 saat KTT G20 di Bali  https://t.co/xImBUlgkF3 #Bmkg #KttG20 #G20 #Bali"
2022-10-03 07:36:02,babegino1,PERSIAPAN KTT G20 DI  BALI INDONESIA ON THE RIGHT TRACK  https://t.co/o49uxIyJ4x
2022-10-03 07:21:44,_JinggaSaja_,Jelang KTT G20 kementan perkuat pengendalian rabies di bali  #LangkahMembangunNegeri  https://t.co/kW5L9MM2L6
2022-10-03 07:07:05,Rosecat27412184,Ketua MPR dukung kendaraan listrik KTT g20 untuk migrasi kendaraan di Bali  #LangkahMembangunNegeri  https://t.co/DFBZbWpAqT
2022-10-03 07:05:56,Rosecat27412184,Jelang KTT g20 kementerian perkuat pengendalian rabies di Bali  #LangkahMembangunNegeri  https://t.co/cSPTHhnimT
2022-10-05 22:11:25,tribunbanten,"PLN Siapkan 66 SPKLU Tersebar di Bali, Demi Mendukung Operasional Kendaraan Listrik KTT G20 di Bali    https://t.co/2LV74HgFwJ lewat @tribunbanten"
2022-10-05 21:53:08,NTMC_Info,Kakorlantas Polri Pastikan Personel Siap Kawal dan Amankan Rute dan Perhelatan Konferensi Tingkat Tinggi (KTT) G20 di Pulau Dewata Bali   https://t.co/UVMqOYagre
2022-10-05 21:43:11,IndoMaju_,"Penyelenggaraan pertemuan puncak negara-negara G20 di Bali pada November 2022 makin dekat. Untuk itu, Presiden Joko Widodo kembali memimpin rapat bersama jajaran kabinetnya untuk mematangkan berbagai persiapan KTT G20 di Istana Merdeka pada Senin, 3 Oktober 2022. #Jokowi  https://t.co/xz43wE78lm"
2022-10-05 21:28:03,Marbot_Udien,"@hyang_wisnu @kemkominfo @jokowi @PlateJohnny Untuk itu, masyarakat diminta agar menangkal &amp; memerangi berita hoax yang mendiskreditkan kebijakan pemerintah dalam upaya antisipasi ancaman cyber dalam upaya tercipta situasi yang aman &amp; kondusif dalam rangka mendukung &amp; mensukseskan KTT G20 di Bali. @PlateJohnny @kemkominfo"
2022-10-05 21:26:44,KabariGolkar,"Kunjungi Bali, Menko Luhut Pantau Simulasi Penyambutan Tamu Kenegaraan dan Tinjau Venue Gelaran KTT G20   https://t.co/lMzzomVZoJ lewat @kabargolkarcom"
2022-10-05 21:07:31,detikfinance,Masyarakat Bali diminta untuk kerja dari rumah atau melakukan work from home (WFH) pada saat Konferensi Tingkat Tinggi (KTT) G20 berlangsung November mendatang.  https://t.co/YEPoJQwTmy
2022-10-05 21:07:09,BaliEkbis,"Siap Sukseskan KTT G20, Ini Strategi PLN untuk Tingkatkan Keandalan Listrik di Bali  https://t.co/lEsN4YutcO"
2022-10-05 21:06:51,DamaiSulbar,"Saya memohon majelis adat, pecalang dan pihak masjid dan gereja untuk ikut menjaga situasi kamtibmas di wilayah masing-masing.  #Indonesia #Bali #KTT #G20 #Damai #LawanTerorisme #TangkalRadikalisme #Merdeka #PancasilaDasarNegara #NkriHargaMati #Malaqbi #MelleteDiatonganang  https://t.co/BwZNhx53vO"
2022-10-05 21:06:05,DamaiSulbar,Mari kita bersama-sama menjaga situasi keamanan.  #Indonesia #Bali #KTT #G20 #Damai #LawanTerorisme #TangkalRadikalisme #Merdeka #PancasilaDasarNegara #NkriHargaMati #Malaqbi #MelleteDiatonganang #Manakarra #SulbarInfo #SulbarModerat #PolewaliMandar #Majene #Mamuju #MamujuTengah  https://t.co/Y4t9rIiltu
2022-10-05 21:05:17,DamaiSulbar,Upaya mencegah raadikalisme lewat kurikulum sekolah.  #Indonesia #Bali #KTT #G20 #Damai #LawanTerorisme #TangkalRadikalisme #Merdeka #PancasilaDasarNegara #NkriHargaMati #Malaqbi #MelleteDiatonganang #Manakarra #SulbarInfo #SulbarModerat #PolewaliMandar #Majene #Mamuju  https://t.co/Dg7PEdHBr6
2022-10-05 21:03:26,DamaiSulbar,Siapa pun yang nantinya akan menjadi calon presiden (capres) di pemilu 2024 harus mampu menjunjung tinggi persatuan dan kesatuan bangsa Indonesia.  #Indonesia #Bali #KTT #G20 #Damai #LawanTerorisme #TangkalRadikalisme #Merdeka #PancasilaDasarNegara #NkriHargaMati #Malaqbi  https://t.co/kzK2XgkUc9
2022-10-05 21:02:41,DamaiSulbar,Pancasila adalah ideologi yang digali dan dirumuskan oleh para pendahulu dari akar dan karakter bangsa Indonesia sendiri.  #Indonesia #Bali #KTT #G20 #Damai #LawanTerorisme #TangkalRadikalisme #Merdeka #PancasilaDasarNegara #NkriHargaMati #Malaqbi #MelleteDiatonganang #Manakarra  https://t.co/9zmZaayjQw
2022-10-05 21:01:51,DamaiSulbar,"G-20 mempresentasikan lebih dari 60% populasi bumi, 75% perdagangan global, dan 80% PDB dunia.  #Indonesia #Bali #KTT #G20 #Damai #LawanTerorisme #TangkalRadikalisme #Merdeka #PancasilaDasarNegara #NkriHargaMati #Malaqbi #MelleteDiatonganang #Manakarra #SulbarInfo #SulbarModerat  https://t.co/EACmN5xsvO"
2022-10-05 21:00:54,DamaiSulbar,"Kesiapan menyambut KTT G-20 Bali 15-16 November 2022 on track, dalam track yang kita harapkan akan membawa suksesnya dan insya allah lancarkan perhelatan tersebut.  #Indonesia #Bali #KTT #G20 #Damai #LawanTerorisme #TangkalRadikalisme #Merdeka #PancasilaDasarNegara #NkriHargaMati  https://t.co/FhkroO0ovM"
2022-10-05 21:00:10,DamaiSulbar,Indonesia terus pantau perkembangan global demi mitigasi di KTT G-20.  #Indonesia #Bali #KTT #G20 #Damai #LawanTerorisme #TangkalRadikalisme #Merdeka #PancasilaDasarNegara #NkriHargaMati #Malaqbi #MelleteDiatonganang #Manakarra #SulbarInfo #SulbarModerat #PolewaliMandar #Majene  https://t.co/lQmsmkBlcW
2022-10-05 20:59:24,DamaiSulbar,#Indonesia #Bali #KTT #G20 #Damai #LawanTerorisme #TangkalRadikalisme #Merdeka #PancasilaDasarNegara #NkriHargaMati #Malaqbi #MelleteDiatonganang #Manakarra #SulbarInfo #SulbarModerat #PolewaliMandar #Majene #Mamuju #MamujuTengah #Mamasa #Pasangkayu #Topoyo  https://t.co/ibaD7Sn4so
2022-10-05 20:58:29,DamaiSulbar,"Saya merasa bersyukur kepada tuhan yang telah menganugrahkan seorang alim ulama besar di Indonesia, yaitu Syaikhona Muhammad Kholil karena kecerdasan spiritual dan kedalaman ilmunya.  #Indonesia #Bali #KTT #G20 #Damai #LawanTerorisme #TangkalRadikalisme #Merdeka  https://t.co/OfQWHXMXOP"
2022-10-05 20:55:05,jpnncom,"388.123 ternak berkaki empat belum mendapat jatah vaksinasi menjelang KTT G20, Satgas PMK Bali bergerak cepat #ternak  https://t.co/GL13sIGKqx"
2022-10-05 20:43:03,kabargolkarnews,"Kunjungi Bali, Menko Luhut Pantau Simulasi Penyambutan Tamu Kenegaraan dan Tinjau Venue Gelaran KTT G20   https://t.co/vQ3Fr0qKaW lewat @kabargolkarcom"
2022-10-05 19:29:06,CryptoKuta,"Kadis Kominfo Kota Denpasar,Alit Adhi Merta : Disinformasi sangat massif,Masyarakat harus mampu melakukan filterisasi,tidak mudah terprovokasi oleh beragam informasi.  “Mari kita sama-sama perangi Hoax,Sukseskan KTT G20 di Provinsi Bali”  @PlateJohnny    https://t.co/kvQTmVhAYd"
2022-10-05 19:24:02,BakuBage,Pemerintah pastikan hotel di Bali Siap sambut KTT G20.  #G20Indonesia #RecoverTogetherRecoverStronger #G20Indonesia2022 #GroupOfTwentyIndonesia - Maluku Siap Kawal -  https://t.co/kDy7inweaF
2022-10-05 19:15:29,InfoPublikIP,"Sejumlah persiapan terus dimatangkan pemerintah jelang pelaksanaan Konferensi Tingkat Tinggi (KTT) G20 di Bali, November 2022 mendatang, terutama terkait fasilitas layanan kesehatan dan telah menyiapkan tiga aspek penting.  https://t.co/lwAxEshhni"
2022-10-05 19:15:18,baliexpressnews,"Selama KTT G20, Pembelajaran Siswa Kembali Daring  https://t.co/zLmovrVV5k"
2022-10-05 18:51:11,BotakPahlawan,Pemerintah memastikan persiapan hotel-hotel di Bali jelang puncak Konferensi Tingkat Tinggi (KTT) G20 sudah sesuai jalur. Dengan persiapan matang yang telah dilakukan akan membawa kesuksesan dalam penyelenggaraan KTT G20.  https://t.co/DBesSGnv7x
2022-10-05 18:49:10,sherlynlyn_,"Indonesia gitu lohh, bikin para delegasi terkesan  KTT G20 di Bali sukses dan aman #G20Indonesia #RecoverTogetherRecoverStronger #G20Indonesia2022 #GroupOfTwentyIndonesia  https://t.co/yDD5M1R9iS"
2022-10-05 18:49:00,newsmerahputih,"Menteri Luhut Binsar Pandjaitan mengatakan, persiapan KTT G20 di Bali semakin baik dan sempurna.  #merahputihcom #KTTG20 #Luhut #Telkom #Bali   https://t.co/hCpeiHyngI"
2022-10-05 18:48:32,sherlynlyn_,pastiny ningkatin kunjungan wisatawan di Indonesia nanti  KTT G20 di Bali sukses dan aman #G20Indonesia #RecoverTogetherRecoverStronger #G20Indonesia2022 #GroupOfTwentyIndonesia  https://t.co/sak6jBQ6C9
2022-10-05 18:48:11,sherlynlyn_,jujurly sebagai masyarakat Indonesia bangga bangett  KTT G20 di Bali sukses dan aman #G20Indonesia #RecoverTogetherRecoverStronger #G20Indonesia2022 #GroupOfTwentyIndonesia  https://t.co/Z190Z37czt
2022-10-05 18:47:49,sherlynlyn_,"telkom pasti udh ready sih, jadi sudah dipastikan aman  KTT G20 di Bali sukses dan aman #G20Indonesia #RecoverTogetherRecoverStronger #G20Indonesia2022 #GroupOfTwentyIndonesia  https://t.co/S6moSwGHBr"
2022-10-05 18:47:24,sherlynlyn_,sangat sangat siapp dong Bali  KTT G20 di Bali sukses dan aman #G20Indonesia #RecoverTogetherRecoverStronger #G20Indonesia2022 #GroupOfTwentyIndonesia  https://t.co/dVxv5RPsAJ
2022-10-05 18:46:01,KompasOtomotif,AHM Siapkan 20 Unit PCX Electric buat KTT G20 di Bali  https://t.co/0SG1vMMQzf
2022-10-05 18:29:40,VincentiusBria2,Pemerintah pastikan hotel di Bali siap sambut KTT G20 Bengkulu  #G20Indonesia #RecoverTogetherRecoverStronger #G20Indonesia2022 #GroupOfTwentyIndonesia  https://t.co/9GFVciVP0N
2022-10-05 18:18:40,kompascom,Masjid Raya Sheikh Zayed akan diresmikan setelah Konferensi Tingkat Tinggi (KTT) G20 di Bali pada pertengah November 2022.  https://t.co/nZyFjlDxfg
2022-10-05 18:11:44,diego_mines,Pemerintaj pastikan Hotel di bali siap sambut KTT G20 #G20Indonesia #RecoverTogetherRecoverStronger #G20Indonesia2022 #GroupOfTwentyIndonesia  Sulawesi Utara  https://t.co/jrwlBiYMfo
2022-10-05 18:11:03,diego_mines,KTT G20 Bali #G20Indonesia #RecoverTogetherRecoverStronger #G20Indonesia2022 #GroupOfTwentyIndonesia Sulawesi Utara  https://t.co/xzkvYUjXvl
2022-10-05 18:09:44,SandraH22095798,KESIAPAN MENHADAPI KTT G20 BALI #G20Indonesia #RecoverTogetherRecoverStronger #G20Indonesia2022 #GroupOfTwentyIndonesia  https://t.co/ybhtgVdYuL
2022-10-05 17:56:07,reginanaung,Bangga Indonesia Menjadi Tuan Rumah KTT G20 Bali   Suara Bali  #G20Indonesia #RecoverTogetherRecoverStronger #G20Indonesia2022 #GroupOfTwentyIndonesia  https://t.co/yYLOKBl88r
2022-10-05 17:53:54,reginanaung,Kesiapan jaringan telekomunikasi indonesia menghadapi KTT G20 Bali Mantap   Suara Bali  #G20Indonesia #RecoverTogetherRecoverStronger #G20Indonesia2022 #GroupOfTwentyIndonesia  https://t.co/41orDCg2yJ
2022-10-02 21:51:10,ispeidata,"Jelang KTT G20, Kementan Perkuat Pengendalian Rabies di Bali  https://t.co/1o9Cwj8zs4"
2022-10-02 19:04:31,wangwang302,@gidle_25 Gila padahal mau KTT g20 di bali november nanti hmmm
2022-10-02 19:02:58,BUMNBdgSigap,"Sobat BUMN,  Green Energy Station (GES) @Pertamina siap melayani para delegasi KTT G20 di Bali pada November 2022 untuk kebutuhan kendaraan kegiatan G20 yang sebagian besar menggunakan kendaraan listrik ramah lingkungan.  https://t.co/fY5KF0LuSg"
2022-10-02 17:15:43,langkatoday,"Jelang KTT G20 Bali, BMKG Siapkan Mitigasi Skenario Terburuk Gempa Bumi   https://t.co/2OmmYvbvfJ"
2022-10-02 16:46:35,DamaiSulbar,Nabi mengajak perubahan sosial dari buruk menjadi baik.  #Indonesia #Bali #KTT #G20 #Damai #LawanTerorisme #TangkalRadikalisme #Merdeka #PancasilaDasarNegara #NkriHargaMati #Malaqbi #MelleteDiatonganang #Manakarra #SulbarInfo #SulbarModerat #PolewaliMandar #Majene #Mamuju  https://t.co/hwspVBO6Om
2022-10-02 16:45:51,DamaiSulbar,Guru agama berperan memberikan pelajaran Islam yang rahmatan lil alamin.  #Indonesia #Bali #KTT #G20 #Damai #LawanTerorisme #TangkalRadikalisme #Merdeka #PancasilaDasarNegara #NkriHargaMati #Malaqbi #MelleteDiatonganang #Manakarra #SulbarInfo #SulbarModerat #PolewaliMandar  https://t.co/a1VpjmTJac
2022-10-02 16:45:12,DamaiSulbar,"Islam mengajarkan hidup seimbang antara material dan spiritual, duniawi dan ukhrawi.  #Indonesia #Bali #KTT #G20 #Damai #LawanTerorisme #TangkalRadikalisme #Merdeka #PancasilaDasarNegara #NkriHargaMati #Malaqbi #MelleteDiatonganang #Manakarra #SulbarInfo #SulbarModerat  https://t.co/9lmeUHFWCB"
2022-10-02 16:44:24,DamaiSulbar,Islam akan berkualitas jika umatnya mampu menguasai ilmu pengetahuan dan teknologi.  #Indonesia #Bali #KTT #G20 #Damai #LawanTerorisme #TangkalRadikalisme #Merdeka #PancasilaDasarNegara #NkriHargaMati #Malaqbi #MelleteDiatonganang #Manakarra #SulbarInfo #SulbarModerat  https://t.co/6aNzVGTwBo
2022-10-02 16:43:45,DamaiSulbar,Agama hadir untuk keselamatan kebahagiaan dan kesejahteraan manusia.  #Indonesia #Bali #KTT #G20 #Damai #LawanTerorisme #TangkalRadikalisme #Merdeka #PancasilaDasarNegara #NkriHargaMati #Malaqbi #MelleteDiatonganang #Manakarra #SulbarInfo #SulbarModerat #PolewaliMandar #Majene  https://t.co/Jy7WfPrEJ1
2022-10-02 16:43:12,DamaiSulbar,"ada prinsipnya, semua agama mengajarkan kebaikan.  #Indonesia #Bali #KTT #G20 #Damai #LawanTerorisme #TangkalRadikalisme #Merdeka #PancasilaDasarNegara #NkriHargaMati #Malaqbi #MelleteDiatonganang #Manakarra #SulbarInfo #SulbarModerat #PolewaliMandar #Majene #Mamuju #MamujuTengah  https://t.co/qkvXDKwcZJ"
2022-10-02 16:42:30,DamaiSulbar,200 Dai dan khatib di Surabaya deklarasikan lawan Radikalisme.  #Indonesia #Bali #KTT #G20 #Damai #LawanTerorisme #TangkalRadikalisme #Merdeka #PancasilaDasarNegara #NkriHargaMati #Malaqbi #MelleteDiatonganang #Manakarra #SulbarInfo #SulbarModerat #PolewaliMandar #Majene #Mamuju  https://t.co/mQfPRKncIa
2022-10-02 16:41:55,DamaiSulbar,Ekonomi Indonesia termasuk yang paling tinggi di antara negara-negara anggota G-20.  #Indonesia #Bali #KTT #G20 #Damai #LawanTerorisme #TangkalRadikalisme #Merdeka #PancasilaDasarNegara #NkriHargaMati #Malaqbi #MelleteDiatonganang #Manakarra #SulbarInfo #SulbarModerat  https://t.co/YugIWdDAtz
2022-10-02 16:41:20,DamaiSulbar,Mari bersatu menjaga Pancasila !  #Indonesia #Bali #KTT #G20 #Damai #LawanTerorisme #TangkalRadikalisme #Merdeka #PancasilaDasarNegara #NkriHargaMati #Malaqbi #MelleteDiatonganang #Manakarra #SulbarInfo #SulbarModerat #PolewaliMandar #Majene #Mamuju #MamujuTengah #Mamasa  https://t.co/q9EISKc6Qt
2022-10-02 16:40:41,DamaiSulbar,Keberagaman dan perbedaan bukanlah kelemahan melainkan sebuah kekuatan.  #Indonesia #Bali #KTT #G20 #Damai #LawanTerorisme #TangkalRadikalisme #Merdeka #PancasilaDasarNegara #NkriHargaMati #Malaqbi #MelleteDiatonganang #Manakarra #SulbarInfo #SulbarModerat #PolewaliMandar #Majene  https://t.co/Lgb66hDAIP
2022-10-02 15:44:14,IntanAyuArimbi,Ketua MPR RI mendukung kendaraan listrik KTT G20 untuk migrasi kendaraan di Bali.  https://t.co/VwrOm4benr
2022-10-02 15:36:47,CEOfficialID,"Jelang KTT G20 di Bali, DPR: Ini Cara Meningkatkan Pertumbuhan Ekonomi  https://t.co/98INS4GJem"
2022-10-02 15:13:40,LisaWri39975245,Fasilitas layanan kesehatan pada KTT G20 siap dihotel utama  Apurva Kempinski Bali . #G20Indonesia #RecoverTogetherRecoverStronger #G20Indonesia2022 #GroupOfTwentyIndonesia  Jawa Tengah
2022-10-02 15:13:16,LisaWri39975245,Komunitas parakreaf di Bali diajak sukseskan KTT G20 . #G20Indonesia #RecoverTogetherRecoverStronger #G20Indonesia2022 #GroupOfTwentyIndonesia  Jawa Tengah
2022-10-02 14:50:03,okezonenews,"Jelang KTT G20 di Bali, DPR: Ini Cara Meningkatkan Pertumbuhan Ekonomi #LengkapCepatBeritanya #Keuangan #Ekonomi #Ekonomi #EkonomiIndonesia .  https://t.co/R4lbvHyjMU"
2022-10-02 14:34:02,tauberitamedia,Kepala BMKG Dwikorita mengatakan BMKG menyiapkan langkah mitigasi mengantisipasi skenario terburuk jika terjadi bencana alam saat pelaksanaan KTT G20 di Bali.  https://t.co/pvZvnCgKTU
2022-10-05 17:53:32,Spy_Zone85,Mari kita sama-sama perangi berita hoax dalam rangka menyukseskan pelaksanaan KTT G20 di Provinsi Bali. @kemkominfo @PlateJohnny @jokowi  https://t.co/aXy4rRK6TR
2022-10-05 17:52:55,reginanaung,Pemerintah melalui Menparekraf Sandiaga Uno memastikan hotel di Bali siap untuk menyambut KTT G20  Suara Bali  #G20Indonesia #RecoverTogetherRecoverStronger #G20Indonesia2022 #GroupOfTwentyIndonesia  https://t.co/GcTv2VL6VH
2022-10-05 17:49:10,AryPrasetyo_85,"1.337 jurnalis dari 215 media lokal dan asing telah melakukan pendaftaran peliputan Konferensi Tingkat Tinggi (KTT) G20 di Provinsi Bali pada 15-16 November 2022 mendatang, melalui website G20. @kemkominfo @jokowi @PlateJohnny  https://t.co/RXA0XHdFjK"
