date,username,tweet
2022-10-06 17:12:10,wahananewsdotco,"Siap Sukseskan KTT G20, PLN Targetkan Relokasi PLTG Grati ke Bali Tuntas Akhir Oktober  https://t.co/uUgkJc6qLv #Pln #PtPln #PtPlnPersero #Pltg"
2022-10-06 17:06:00,motorplusweekly,20 Honda PCX Electric Diserahkan PT AHM Untuk Motor Dishub Bali Saat KTT G20    https://t.co/8ekGtNfpAD
2022-10-06 17:02:02,RokhanaSti,"Usai meninjau beberapa infrastruktur jalan yang akan dilalui oleh para pemimpin negara G20. Selanjutnya, Presiden @jokowi meninjau Tahura Ngurah Rai Bali yang akan menjadi salah satu tempat dilaksanakannya rangkaian perhelatan KTT G20 Bali 2022.  https://t.co/obCqSvgDuQ"
2022-10-06 16:56:11,Hadimakpul,"Presiden @jokowi meninjau Taman Hutan Raya (Tahura) Ngurah Rai untuk mendukung perhelatan KTT G20 Bali 2022. Menurut Presiden, Tahura Ngurah Rai akan menjadi sebuah tempat yang dapat memperlihatkan kepedulian Indonesia terhadap lingkungan kepada dunia.  https://t.co/tAahGJFBUl"
2022-10-06 16:54:02,timescoid,Presiden Jokowi Tinjau Kesiapan KTT G20 di Bali ... ...  https://t.co/T6Ge8wnuWx #timesindonesia #ketahananinformasi #indonesiabangkit
2022-10-06 16:51:10,soloposdotcom,"Pastikan Kesiapan Lokasi KTT G20, Jokowi Kunjungi Tahura Ngurah Rai Bali  https://t.co/2n7K8XM5cT"
2022-10-06 16:48:35,timescoid,"Tinjau Kesiapan KTT G20 di Bali, Presiden Jokowi: Betul-Betul Surprise: Presiden Jokowi Tinjau Kesiapan KTT G20 di Bali ... ...  https://t.co/ZmI2QCZpjI #beritabaik #timesindonesia #ketahananinformasi"
2022-10-06 16:29:07,wahananewsdotco,"Siap Sukseskan KTT G20, Ini Strategi PLN untuk Tingkatkan Keandalan Listrik di Bali  https://t.co/RJtWpPdUkr #Pln #PtPln #PlnPower #KttG20"
2022-10-06 16:23:25,DamaiSulbar,#Indonesia #Bali #KTT #G20 #Damai #LawanTerorisme #TangkalRadikalisme #Merdeka #PancasilaDasarNegara #NkriHargaMati #Malaqbi #MelleteDiatonganang #Manakarra #SulbarInfo #SulbarModerat #PolewaliMandar #Majene #Mamuju #MamujuTengah #Mamasa #Pasangkayu #Topoyo  https://t.co/F3oHaJRNlL
2022-10-06 16:21:29,DamaiSulbar,#Indonesia #Bali #KTT #G20 #Damai #LawanTerorisme #TangkalRadikalisme #Merdeka #PancasilaDasarNegara #NkriHargaMati #Malaqbi #MelleteDiatonganang #Manakarra #SulbarInfo #SulbarModerat #PolewaliMandar #Majene #Mamuju #MamujuTengah #Mamasa #Pasangkayu #Topoyo  https://t.co/eGiuIshvf0
2022-10-06 16:20:38,DamaiSulbar,#Indonesia #Bali #KTT #G20 #Damai #LawanTerorisme #TangkalRadikalisme #Merdeka #PancasilaDasarNegara #NkriHargaMati #Malaqbi #MelleteDiatonganang #Manakarra #SulbarInfo #SulbarModerat #PolewaliMandar #Majene #Mamuju #MamujuTengah #Mamasa #Pasangkayu #Topoyo  https://t.co/Qpo8ZXToUd
2022-10-06 16:20:02,KikhmahMerlina,Bali Compendium akan dibawa Indonesia ke KTT G20 pada November  Arsjad Rasjid #b20 #arsjadrasjid #kompendiumbali #inklusifkolaboratif
2022-10-06 16:17:00,Mmc99934673,"Siap Sukseskan KTT G20, PLN Targetkan Relokasi PLTG Grati ke Bali Tuntas Akhir Oktober  https://t.co/vwhb9Nus2s"
2022-10-06 16:16:58,transbjn,"Siap Sukseskan KTT G20, PLN Targetkan Relokasi PLTG Grati ke Bali Tuntas Akhir Oktober  https://t.co/VosYlfH6pz"
2022-10-06 16:13:44,reginanaung,Presiden jokowi siap buka G20 bali Ayo Kawal dan sukseskan Event KTT G20   Suara Bali  #G20Indonesia #RecoverTogetherRecoverStronger #G20Indonesia2022 #GroupOfTwentyIndonesia  https://t.co/4Nt13RiDAp
2022-10-06 16:09:36,LisaWri39975245,Kesiapan jaringan telekomunikasi Indonesia menghadapi KTT G20 Bali . #G20Indonesia #RecoverTogetherRecoverStronger #G20Indonesia2022 #GroupOfTwentyIndonesia  Jawa Tengah
2022-10-04 13:08:40,Johnss___,"Pengamanan Rangkaian KTT G20 Bali  Polda Bali siapkan Personel guna pengamanan rangkaian KTT G20 diantaranya TTIWG dan TIIMM di Nusa Dua, Bali  #KawalG20 Tingkatkan Perekonomian  https://t.co/HHHI0Ug0pJ"
2022-10-04 13:07:47,Johnss___,Polri Siap #KawalG20  Polri Siap laksanakan Tugas Pengamanan KTT G20 di Bali sebagai salah satu langkah dalam program Pemulihan Ekonomi Nasional serta Tingkatkan Perekonomian Negara  https://t.co/BADnSylSA8
2022-10-04 13:07:11,Johnss___,Pengamanan KTT G20 Bali  Ratusan kendaraan listrik disiapkan oleh Korlantas Polri guna pengamanan rangkaian KTT G20 di Bali  #KawalG20 Tingkatkan Perekonomian  https://t.co/l3cTDhj3c8
2022-10-04 13:06:39,Johnss___,"Persiapan Pengamanan dan #KawalG20  Jelang KTT G20 di Bali yang akan digelar 15-16 November 2022, Polda Bali akan lakukan Operasi Pura Agung untuk pengamanan selama KTT G20, Tingkatkan Perekonomian Negara  https://t.co/fzPInnlPbO"
2022-10-04 13:05:25,Johnss___,#KawalG20  Tingkatkan Perekonomian Polda Bali terjunkan 11 satuan tugas (satgas) untuk pengamanan pintu masuk dan lokasi field trip para delegasi peserta KTT G20 selain itu Polda Bali juga sudah mempersiapkan pola pengamanan dengan sistem zonasi  https://t.co/BoCUZMcQDc
2022-10-04 13:04:43,Johnss___,"Puncak KTT G20 di Bali   Tingkatkan Perekonomian KTT G20 di Bali 15- 16 November, Polri siapkan 88 mobil listrik dan 94 motor listrik untuk pengamanan dan pengawalan selama G20 berlangsung  #KawalG20  https://t.co/b10DfEYpBz"
2022-10-04 13:00:17,Johnss___,Polri siap amankan pelaksanaan KTT G20 di Bali sebagai upaya mendukung pemulihan ekonomi pasca pandemi  #PenyelanggaranG20 Peningkatan Ekonomi Negara  https://t.co/soawA7buxh
2022-10-04 12:59:43,Johnss___,Sebanyak 6.826 personel akan ditempatkan di sejumlah titik pelaksanaan KTT G20 di Bali guna mengantisipasi potensi gangguan selama konferensi tersebut berlangsung  #PenyelanggaranG20 Peningkatan Ekonomi Negara  https://t.co/UxrrZFnxSx
2022-10-04 12:58:51,Johnss___,Pengawalan #PenyelanggaranG20 di Bali  Korlantas Polri menyiapkan ratusan kendaraan listrik guna mengawal pelaksanaan KTT G20 di Bali. Peningkatan Ekonomi Negara  https://t.co/ccDF22vNIm
2022-10-04 12:58:04,Johnss___,"Persiapan #PenyelanggaranG20 Peningkatan Ekonomi Negara   Polda Bali pastikan kesiapan pengamanan mulai dari personel, sarana, dan prasarana untuk mendukung kelancaran pengamanan KTT G20  https://t.co/giyzna1ssi"
2022-10-04 12:57:31,Johnss___,Mobil Listrik Untuk Akomodasi Pengamanan #PenyelanggaranG20  Korlantas Polri siapkan 88 unit mobil listrik dan 94 unit sepeda motor listrik untuk mengamankan dan mengawal KTT G20 15 - 16 November 2022 di Bali. Peningkatan Ekonomi Negara  https://t.co/Z701ssaAJC
2022-10-04 12:29:11,mang_ib,"Selain itu, dalam rapat juga dibahas mengenai kesiapan di Bali juga detail sesi pada saat KTT G20 nanti. Menurut Airlangga, Indonesia berharap agar keseluruhan hasil pembahasan para pemimpin negara G20 bisa sederhana dan dirangkum dalam 34 paragraf.  https://t.co/cWJgKBDhfL"
2022-10-04 12:25:40,mang_ib,Presiden @jokowi Kembali Pimpin Rapat untuk Matangkan Persiapan KTT G20  Penyelenggaraan pertemuan puncak negara-negara G20 di Bali pada November 2022 makin dekat.  https://t.co/m5aYVwGo9i
2022-10-04 12:19:25,waluhrebus,"@jokowi @mohmahfudmd  Saya yakin kalau pemerintah masih planga plongo berputar-putar siapa yang bersalah, wajah indonesia di G20 KTT bali akan sangat buruk dan banyak negara menyerang/menyudutkan secara politik thd 🇮🇩 Padahal sudah jelas tersangka polda jatim  #PrayForKanjuruhan"
2022-10-04 12:17:21,sandiuno,"Hari ini saya menuju Bali, menghadiri beberapa agenda termasuk melakukan rapat koordinasi persiapan penyelenggaraan KTT G20 bersama @kemenkomarves, yang mana pertemuan puncaknya akan digelar pada 15-16 November 2022."
2022-10-04 11:50:00,inewsdotid,"Wisatawan Liburan ke Bali saat KTT G20, Sandiaga Uno: Kamar Hotel Masih Tersedia di Ubud hingga Sanur  https://t.co/E14eq7sDpC"
2022-10-04 11:49:18,Citralokadwipa,"Presiden Joko Widodo akan meninjau langsung lokasi pelaksanaan pertemuan G20, untuk memastikan kesiapan Bali sebagai tuan rumah. Presiden juga ingin memastikan detail agenda pertemuan karena agenda KTT G20 berdekatan waktunya dengan  KTT ASEAN dan APEC. #IndonesiaMaju #Jokowi  https://t.co/LdTnhv9K2R"
2022-10-04 11:49:16,Citralokadwipa,"Pertemuan puncak negara-negara G20 di Bali yang semakin dekat, membuat  Presiden Joko Widodo kembali memimpin rapat bersama jajaran kabinetnya untuk mematangkan berbagai persiapan KTT G20, di Istana Merdeka, Jakarta, Senin(3/10/22) #IndonesiaMaju #Jokowi"
2022-10-04 11:44:26,ariefskie,"Penyelenggaraan pertemuan puncak negara-negara G20 di Bali pada November 2022 makin dekat. Untuk itu, Presiden @jokowi kembali memimpin rapat bersama kabinetnya untuk mematangkan berbagai persiapan Konferensi Tingkat Tinggi (KTT) G20 di Istana Merdeka, pada Senin, 3 Oktober 2022.  https://t.co/ZvNoHu9HWP"
2022-10-06 16:09:19,BentangImaji,"Usai membuka World Conference on Creative Economy (WCCE) ke-3 pada Kamis, 6 Oktober 2022, Presiden @jokowi meninjau pembangunan infrastruktur jalan di daerah Nusa Dua, Kabupaten Badung, Bali yang akan dilalui oleh para pemimpin dunia yang menghadiri KTT G20 pada bulan November.  https://t.co/YMIwrGxZWd"
2022-10-06 16:05:32,Cak_X01,"Usai membuka World Conference on Creative Economy (WCCE) ke-3 pada Kamis, 6 Oktober 2022, Presiden @jokowi meninjau pembangunan infrastruktur jalan di daerah Nusa Dua, Kabupaten Badung, Bali yang akan dilalui oleh para pemimpin dunia yang menghadiri KTT G20 pada bulan November.  https://t.co/iO2pltaKa0"
2022-10-06 16:04:46,DamaiSulbar,Memutus regenerasi teroris !  #Indonesia #Bali #KTT #G20 #Damai #LawanTerorisme #TangkalRadikalisme #Merdeka #PancasilaDasarNegara #NkriHargaMati #Malaqbi #MelleteDiatonganang #Manakarra #SulbarInfo #SulbarModerat #PolewaliMandar #Majene #Mamuju #MamujuTengah #Mamasa #Pasangkayu  https://t.co/NecY7QzjaG
2022-10-06 16:04:04,DamaiSulbar,"kita ingin para pemimpin nasional nanti akan membawa semangat untuk bisa membangun, akan mau mewujudkan, menunjukkan propgram-programnya untuk bisa menyejahterakan masyarakat.  #Indonesia #Bali #KTT #G20 #Damai #LawanTerorisme #TangkalRadikalisme #Merdeka #PancasilaDasarNegara  https://t.co/su8fMffmOS"
2022-10-06 16:03:15,DamaiSulbar,"Isu toleransi, radikalisme, dan terorisme di Indonesia tidak bisa dianggap sebelah mata.  #Indonesia #Bali #KTT #G20 #Damai #LawanTerorisme #TangkalRadikalisme #Merdeka #PancasilaDasarNegara #NkriHargaMati #Malaqbi #MelleteDiatonganang #Manakarra #SulbarInfo #SulbarModerat  https://t.co/OLgdglFCw9"
2022-10-06 16:02:30,DamaiSulbar,"Perbedaan itu bukan memecah, tapi mempersatukan.  #Indonesia #Bali #KTT #G20 #Damai #LawanTerorisme #TangkalRadikalisme #Merdeka #PancasilaDasarNegara #NkriHargaMati #Malaqbi #MelleteDiatonganang #Manakarra #SulbarInfo #SulbarModerat #PolewaliMandar #Majene #Mamuju #MamujuTengah  https://t.co/ktTGovk59M"
2022-10-06 16:01:48,DamaiSulbar,TNI-POLRI di Bali ajak tokoh agama jaga kamtibmas sukseskan KTT G-20.  #Indonesia #Bali #KTT #G20 #Damai #LawanTerorisme #TangkalRadikalisme #Merdeka #PancasilaDasarNegara #NkriHargaMati #Malaqbi #MelleteDiatonganang #Manakarra #SulbarInfo #SulbarModerat #PolewaliMandar #Majene  https://t.co/9b8knYOLja
2022-10-06 16:00:57,DamaiSulbar,Keamanan KTT G-20 adalah taruna bagi bangsa Indonesia. mari jaga bersama !  #Indonesia #Bali #KTT #G20 #Damai #LawanTerorisme #TangkalRadikalisme #Merdeka #PancasilaDasarNegara #NkriHargaMati #Malaqbi #MelleteDiatonganang #Manakarra #SulbarInfo #SulbarModerat #PolewaliMandar  https://t.co/K2o3aKnLw2
2022-10-06 16:00:08,DamaiSulbar,"Saya minta ini betul-betul di cek, masalah pesawat ini penting.  #Indonesia #Bali #KTT #G20 #Damai #LawanTerorisme #TangkalRadikalisme #Merdeka #PancasilaDasarNegara #NkriHargaMati #Malaqbi #MelleteDiatonganang #Manakarra #SulbarInfo #SulbarModerat #PolewaliMandar #Majene #Mamuju  https://t.co/DjqzO0iPpK"
2022-10-06 15:57:02,tauberitamedia,Presiden Joko Widodo (Jokowi) meninjau sejumlah kesiapan fasilitas menjelang pelaksanaan KTT G20 Bali 2022.  https://t.co/lmhmwvehcn
2022-10-06 15:56:32,Hadimakpul,"Presiden @jokowi meninjau pembangunan infrastruktur jalan di daerah Nusa Dua, Kabupaten Badung, Provinsi Bali yang akan dilalui oleh para pemimpin dunia yang menghadiri KTT G20 pada bulan November mendatang.  https://t.co/emQJ027gwn"
2022-10-06 15:51:53,RCyberProjo,"pelaksanaan KTT G20 Bali 2022 dapat berjalan lancar.  “Saya melihat semuanya hampir sudah siap, alhamdulillah, dan kita harapkan nanti dipelaksanaan KTT juga berlangsung dengan baik dan lancar,”  #Jokowi  https://t.co/zgV3sBHppb"
2022-10-06 15:51:48,RCyberProjo,"*Tinjau Tahura Ngurah Rai, Presiden @jokowi: Ini Tunjukkan Kepedulian Indonesia terhadap Lingkungan*     Presiden Joko Widodo meninjau sejumlah kesiapan fasilitas untuk mendukung perhelatan KTT G20 Bali 2022. Presiden berharap dari semua persiapan yang telah dilakukan,  https://t.co/FqIDtC6POx"
2022-10-06 15:51:34,DediPrima13,Peran Humas Polda Bali Menjadi Ujung Tombak Informasi Pelaksanaan KTT G20  BACA SELENGKAPNYA DISINI:  https://t.co/MftmTUzaoO lewat @Radar Berita Indonesia
2022-10-06 15:46:36,bara_juang,"RT jokowi ""Meninjau Taman Hutan Raya (Tahura) Ngurah Rai Bali di Kota Denpasar. Tahura ini akan menjadi salah satu tempat dilaksanakannya rangkaian perhelatan KTT G20 Bali 2022, bulan depan.   Di dalam Tahura sudah ada juga persemaian yang nantinya m…  https://t.co/d8oJAfVsnZ"""
2022-10-06 15:28:02,WarasBareng,"#RT @jokowi: Meninjau Taman Hutan Raya (Tahura) Ngurah Rai Bali di Kota Denpasar. Tahura ini akan menjadi salah satu tempat dilaksanakannya rangkaian perhelatan KTT G20 Bali 2022, bulan depan.   Di dalam Tahura sudah ada juga persemaian yang nantinya men…  https://t.co/qwSCGQ3VQi"
2022-10-06 15:20:03,alineadotid,Presiden Jokowi: Semua fasilitas KTT G20 Bali hampir siap  https://t.co/9H3HX6QPAR  https://t.co/RPY2NUTUtb
2022-10-06 15:17:50,gpnasdempapua,"RT @jokowi: Meninjau Taman Hutan Raya (Tahura) Ngurah Rai Bali di Kota Denpasar. Tahura ini akan menjadi salah satu tempat dilaksanakannya rangkaian perhelatan KTT G20 Bali 2022, bulan depan.   Di dalam Tahura sudah ada juga persemaian yang nantinya meng…  https://t.co/4iLqdoGBIh"
2022-10-06 15:13:11,AlySangadji,"jokowi: Meninjau Taman Hutan Raya (Tahura) Ngurah Rai Bali di Kota Denpasar. Tahura ini akan menjadi salah satu tempat dilaksanakannya rangkaian perhelatan KTT G20 Bali 2022, bulan depan.   Di dalam Tahura sudah ada juga persemaian yang nantinya menghasi…  https://t.co/q1ya1gP8Hf"
2022-10-06 15:08:39,KerjaHasil_id,Presiden meninjau Tahura Ngurah Rai Bali yang akan menjadi salah satu tempat dilaksanakannya rangkaian perhelatan KTT G20 Bali 2022.  𝗝𝗼𝗸𝗼𝘄𝗶 𝗣𝗿𝗼 𝗟𝗶𝗻𝗴𝗸𝘂𝗻𝗴𝗮𝗻 𝗛𝗶𝗱𝘂𝗽  https://t.co/rU1zSafWOz
2022-10-04 11:37:31,papaAntar,"#infoWisata Turis Liburan ke Bali saat KTT G20, Sandiaga Pastikan Masih Tersedia Kamar Hotel di Sanur hingga Ubud  https://t.co/NCzQZsjMpn"
2022-10-04 11:34:32,redidit11,"Penyelenggaraan pertemuan puncak negara-negara G20 di Bali pada November 2022 makin dekat. Untuk itu, Presiden @jokowi kembali memimpin rapat bersama kabinetnya untuk mematangkan berbagai persiapan Konferensi Tingkat Tinggi (KTT) G20 di Istana Merdeka, pada Senin, 3 Oktober 2022.  https://t.co/VZuBYyNw5W"
2022-10-04 11:07:51,santakalsel1,Menparekraf Sebutkan Hotel dan Penerbangan di Bali Siap Untuk KTT G20  https://t.co/vOyI2MpJU6
2022-10-04 09:53:32,Kemenperin_RI,Indonesia sbgai tuan rumah KTT G20 memastikan segala kebutuhan sarana pendukung &amp; logistik keperluan konferensi akan terpenuhi. Persiapan menuju acara puncak di Bali pd 15-16 November trs dilakukan utk memenuhi kebutuhan tamu delegasi yg akan hadir.  #g20updates #G20Indonesia2022  https://t.co/WrWxDFUP7L
2022-10-04 09:52:52,astarte2017,"Untuk memastikan kesiapan Bali sebagai tuan rumah, Presiden Joko Widodo akan meninjau langsung lokasi pelaksanaan pertemuan G20. Presiden juga ingin memastikan detail agenda pertemuan karena KTT G20 berdekatan waktunya dengan pertemuan KTT ASEAN dan APEC. #indonesiamaju #Jokowi  https://t.co/xPkfqh9ci6"
2022-10-04 09:52:50,astarte2017,"Pertemuan puncak negara-negara G20 di Bali pada November 2022 makin dekat. Untuk itu,Presiden Joko Widodo kembali memimpin rapat bersama jajaran kabinetnya untuk mematangkan berbagai persiapan Konferensi Tingkat Tinggi (KTT) G20 di Istana Merdeka, Jakarta,Senin (3/10/22). #Jokowi"
2022-10-04 09:36:12,diiddaaa,"Penyelenggaraan pertemuan puncak negara-negara G20 di Bali pada November 2022 makin dekat. Presiden Joko Widodo kembali memimpin rapat bersama jajaran kabinetnya untuk mematangkan berbagai persiapan Konferensi Tingkat Tinggi (KTT) G20 di Istana Merdeka, Jakarta.  https://t.co/r63UpEgfJo"
2022-10-04 09:04:08,kumparan,"Sandiaga menyebut persiapan KTT G20 di Bali juga sudah pada koridornya, alias on the track. #kumparanTRAVEL  https://t.co/rQsbF3Xv38"
2022-10-04 08:19:57,forjakeu,"Bertemu Menlu Retno, Sekjen PBB Konfirmasi Hadir di KTT G20 Bali  Menlu RI menyampaikan apresiasi atas konfirmasi kehadiran Sekjen PBB di KTT G20 dan menjelaskan mengenai persiapan KTT G20 di Bali pada 15-16 November sejauh ini.  https://t.co/7bwukVjhPj"
2022-10-04 08:13:12,riea_mariska86,Sekjen PBB Antonio Guterres Mengonfirmasi Kehadirannya di KTT G20.  Menteri Luar Negeri RI Retno Marsudi bertemu dengan Sekretaris Jenderal PBB Antonio Guterres yang mengonfirmasi akan hadir dalam konferensi tingkat tinggi (KTT) G20 pada 15-16 November di Bali.  https://t.co/lK3L7XuHiK
2022-10-04 07:47:27,MpokMae,Presiden @jokowi Kembali Pimpin Rapat untuk Matangkan Persiapan KTT G20  Penyelenggaraan pertemuan puncak negara-negara G20 di Bali pada November 2022 makin dekat.  https://t.co/PitcxtgO3J
2022-10-04 07:47:12,GueTionghoa,Presiden @jokowi Kembali Pimpin Rapat untuk Matangkan Persiapan KTT G20  Penyelenggaraan pertemuan puncak negara-negara G20 di Bali pada November 2022 makin dekat.  https://t.co/j42faW3A0j
2022-10-04 07:46:53,DivaCatrii,Presiden @jokowi Kembali Pimpin Rapat untuk Matangkan Persiapan KTT G20  Penyelenggaraan pertemuan puncak negara-negara G20 di Bali pada November 2022 makin dekat.  https://t.co/PDfsF7YjOt
2022-10-04 07:45:58,MSNindonesia,Pemerintah Pastikan Hotel di Bali Siap Sambut KTT G20  https://t.co/vHGbLSDGgB
2022-10-04 07:35:43,nusabalicom,"Buka Agenda Side Event KTT G20, 1.182 Personel Amankan Kunker Presiden ke Bali  https://t.co/IeRooEQhTr #berita #nusabali #KTTG20 #Kunker #Pengamanan"
2022-10-04 06:48:02,KompasTravel,Pemerintah Pastikan Hotel di Bali Siap Sambut KTT G20  https://t.co/Mo2CXRXaOF
2022-10-04 01:39:59,KatokRombeng,Jelang KTT G20 kementan perkuat pengendalian rabies di bali  #LangkahMembangunNegeri  https://t.co/x3yCsEDb45
2022-10-03 23:18:15,hariankompas,Persiapan teknis ataupun substansi KTT G20 yang tinggal beberapa minggu lagi terus dimatangkan pemerintah. Presiden Jokowi pun akan kembali meninjau lokasi pelaksanaan pertemuan G20 di Bali pada November 2022. #Ekonomi #AdadiKompas   https://t.co/DuJk4c9I2A
2022-10-03 23:03:55,mamavanenbas,"Penyelenggaraan pertemuan puncak negara-negara G20 di Bali pada November 2022 makin dekat. Presiden @jokowi kembali memimpin rapat  jajaran kabinetnya untuk mematangkan berbagai persiapan KTT G20 di Istana Merdeka, Jakarta, pada Senin, 3 Oktober 2022.  https://t.co/9fgD3WIaeI  https://t.co/rw8t6nEiWG"
2022-10-03 23:00:03,CEOfficialID,"Wisatawan Liburan ke Bali saat KTT G20, Sandiaga Uno: Kamar Hotel Masih Tersedia di Ubud hingga Sanur  https://t.co/tu713uRXQk"
2022-10-06 15:08:38,KerjaHasil_id,"Tinjau Tahura Ngurah Rai, Presiden: Ini Tunjukkan Kepedulian Indonesia terhadap Lingkungan  Presiden Joko Widodo meninjau sejumlah kesiapan fasilitas untuk mendukung perhelatan KTT G20 Bali 2022.  𝗝𝗼𝗸𝗼𝘄𝗶 𝗣𝗿𝗼 𝗟𝗶𝗻𝗴𝗸𝘂𝗻𝗴𝗮𝗻 𝗛𝗶𝗱𝘂𝗽  https://t.co/VZJt1EOBoU"
2022-10-06 15:04:11,ptinka,"Kepala SBU Tier 1 &amp; 2 PT INKA (Persero), Bapak Febry Pandu Wijaya, meninjau persiapan Stasiun Pengisian Kendaraan Listrik Umum (SPKLU) untuk KTT G20 di Terminal HoHo Pelabuhan Benoa, Bali."
2022-10-06 15:01:40,jokowi,"Meninjau Taman Hutan Raya (Tahura) Ngurah Rai Bali di Kota Denpasar. Tahura ini akan menjadi salah satu tempat dilaksanakannya rangkaian perhelatan KTT G20 Bali 2022, bulan depan.   Di dalam Tahura sudah ada juga persemaian yang nantinya menghasilkan 6 juta bibit pohon.  https://t.co/VWp3LLrjB1"
2022-10-06 14:59:02,tauberitamedia,Presiden Joko Widodo (Jokowi) meninjau sejumlah kesiapan fasilitas untuk mendukung perhelatan KTT G20 Bali 2022. -    https://t.co/r0vkvtFpBQ
2022-10-06 14:57:24,yulitasaarii___,Presiden Jokowi meninjau sejumlah kesiapan fasilitas utk mendukung perhelatan KTT G20 Bali 2022 salah satu nya meninjau Tahura Ngurah Rai Bali. Kepala Negara menilai bahwa Tahura Ngurah Rai akan menjadi tempat yg dpt memperlihatkan kepedulian Indonesia thp lingkungan kepada dunia  https://t.co/tLjD4TK6AA
2022-10-06 14:56:37,djppkemenkumham,"#SahabatPP, Menteri Hukum dan HAM, Yasonna H. Laoly menghadiri rapat koordinasi Kesiapan Presidensi KTT G20. Didampingi oleh Sekretaris Jenderal Kementerian Hukum dan HAM, Sekretaris Direktorat Jenderal Imigrasi, dan Kepala Kantor Bali, Selasa (4/10/2022).  #DitjenppKemenkumham  https://t.co/CF9yNLmReq"
2022-10-06 14:45:04,pnugroho28,"Usai membuka WCCE ke-3 Presiden @jokowi meninjau pembangunan infrastruktur jalan di daerah Nusa Dua, Bali yang akan dilalui oleh para pemimpin dunia yang menghadiri KTT G20 pada bulan November mendatang.  https://t.co/i4SFRzjTxo"
2022-10-06 14:40:27,KerjaHasil_id,"Presiden Joko Widodo meninjau pembangunan infrastruktur jalan di daerah Nusa Dua, Kabupaten Badung, Provinsi Bali yang akan dilalui oleh para pemimpin dunia yang menghadiri KTT G20 pada bulan November mendatang.  𝗝𝗼𝗸𝗼𝘄𝗶 𝗚𝗮𝘀 𝗣𝗼𝗹 𝗜𝗻𝗳𝗿𝗮𝘀𝘁𝗿𝘂𝗸𝘁𝘂𝗿  https://t.co/vd5tLvjTgr"
2022-10-06 14:37:21,setkabgoid,"Presiden @jokowi meninjau Taman Hutan Raya (Tahura) Ngurah Rai Bali, Kota Denpasar, Kamis (06/10/2022), yang akan menjadi salah satu fasilitas untuk mendukung perhelatan KTT G20 Bali 2022.  #PotretKabinet Foto: BPMI Setpres  https://t.co/GU0OvH9Hnk"
2022-10-06 14:33:53,setkabgoid,"Usai membuka WCCE ke-3, Kamis (06/10/2022), Presiden @jokowi meninjau pembangunan infrastruktur jalan di daerah Nusa Dua, Kabupaten Badung, Bali yang akan dilalui oleh para pemimpin dunia yang menghadiri KTT G20 pada bulan November mendatang.  #PotretKabinet Foto: BPMI Setpres  https://t.co/KCd89I09Yx"
2022-10-06 14:30:11,100kpjcom,"Konfrensi Tingkat Tinggi, atau KTT G20 Bali akan berlangsung pada 15-16 November 2022. Tercatat, sejumlah produsen telah menyiapkan kendaraan bertenaga listrik untuk mobilitas selama acara berlangsung.  Selengkapnya :  https://t.co/hDkOKTdzgI  ___ #100kpjcom #Polisi #Teguran  https://t.co/VAl7PDTXGN"
2022-10-06 14:29:40,2Mikeadamhalik,"Presiden @jokowi  meninjau sejumlah kesiapan fasilitas untuk mendukung perhelatan KTT G20 Bali 2022. Presiden berharap dari semua persiapan yang telah dilakukan, pelaksanaan KTT G20 Bali 2022 dapat berjalan lancar.  https://t.co/WTaIxVo3yY"
2022-10-06 14:26:26,2Mikeadamhalik,"Usai membuka World Conference on Creative Economy (WCCE) ke-3  ,Presiden @jokowi meninjau pembangunan infrastruktur jalan di daerah Nusa Dua, Kabupaten Badung, Provinsi Bali yang akan dilalui oleh para pemimpin dunia yang menghadiri KTT G20 pada bulan November mendatang.  https://t.co/N40C5zbcGT"
2022-10-06 14:22:34,yulitasaarii___,"Usai membuka World Conference on Creative Economy (WCCE) ke-3 Kamis, 6 Okt 2022, Presiden Jokowi meninjau pembangunan infrastruktur jalan di daerah Nusa Dua, Kab Badung, Provinsi Bali yang akan dilalui oleh para pemimpin dunia yg menghadiri KTT G20 pada bulan November mendatang  https://t.co/VDzhAICLB1"
2022-10-06 14:00:14,rumah123,Inilah persiapan yang dilakukan Pemerintah Indonesia untuk menyambut kedatangan tamu negara peserta KTT G20 yang akan berlangsung di Bali pada 15-16 November 2022.  https://t.co/2sGq1FntsA #123Info #Rumah123 #Rumah123info
2022-10-06 13:57:11,RianiMaya23,Dukungan Dari Masyarakat Nusa Tenggara Timur Terhadap KTT G20 Di Bali .. #G20Indonesia #RecoverTogetherRecoverStronger #G20Indonesia2022 #GroupOfTwentyIndonesia  https://t.co/d22SopcEGq
2022-10-06 13:30:00,kabarotocom,Sebanyak 20 Motor Honda PCX Electric Digunakan Untuk Penyelenggaraan KTT G20 Bali.  #kabarotocom #honda #hondapcx #kttg20bali #otomotif #beritaotomotif   https://t.co/9XhtYQp2Hy
2022-10-06 13:01:11,berlianmedia1,PT Astra Honda Motor (AHM) menyerahkan 20 unit Honda PCX Electric kepada Dinas Perhubungan Provinsi Bali sebagai kendaraan operasional petugas selama persiapan hingga penyelenggaraan Konferensi Tingkat Tinggi (KTT) Presidensi G20  https://t.co/meMnq6y8Ws
2022-10-06 13:00:36,nolantv_viral,Luhut Minta Bali Terapkan Sekolah Daring dan juga WFH Selama KTT G20  https://t.co/U0PXaicr8T #Terbaru #bali #berita #dan
2022-10-06 12:43:16,indo_pejuang,Pemerintah pastikan Hotel di Bali siap sambuy KTT G20 INDONESIA SIAP JADI TUAN RUMAH G20 Jambi #G20Indonesia #RecoverTogetherRecoverStronger #G20Indonesia2022 #GroupOfTwentyIndonesia  https://t.co/3sIXbXeIlc
2022-10-06 12:43:04,indo_pejuang,JARINGAN TELEKOMUNIKASI UNTUK KTT G20 DI BALI SUDAH DIPERSIAPKAN Jambi #G20Indonesia #RecoverTogetherRecoverStronger #G20Indonesia2022 #GroupOfTwentyIndonesia  https://t.co/MouZ59NXkw
2022-10-06 12:42:51,indo_pejuang,Dengan Adanya KTT G20 Di Bali Peningkatan Pada Sektor Pariwisata Meningkat Drastis  Jambi #G20Indonesia #RecoverTogetherRecoverStronger #G20Indonesia2022 #GroupOfTwentyIndonesia  https://t.co/kK1MF1M2ew
2022-10-06 12:34:51,nanha_Wulandari,Dengan Adanya KTT G20 Di Bali Peningkatan Pada Sektor Pariwisata Meningkat Drastis  -Nusa Tenggara Timur- #G20Indonesia #RecoverTogetherRecoverStronger #G20Indonesia2022 #GroupOfTwentyIndonesia  https://t.co/2BMLfwZ6hJ
2022-10-06 12:15:49,jawapos,"KTT G20 di Bali, Luhut Minta Bali Terapkan Sekolah Daring dan WFH!  https://t.co/8ObmvoL1OO"
2022-10-06 12:12:06,kompascom,Presiden Jokowi meninjau sejumlah lokasi penunjang gelaran KTT G20 di Bali. Jokowi sebut semuanya sudah hampir siap  https://t.co/jRNcEDDqD1
