date,username,tweet
2022-09-30 09:32:03,KemenPU,"#SahabatPUPR, Indonesia selaku Presidensi G20 2022 bersiap menyelenggarakan KTT G20 di Bali pada November mendatang.  #SigapMembangunNegeri #G20Indonesia  https://t.co/gzZtccjoiN"
2022-09-30 09:07:05,Linacuan,Pertamina siapkan green energy station untuk mendukung KTT G20 Bali  https://t.co/bJyPFpRfz2
2022-09-30 09:04:03,antarabiz,AP I latih penanggulangan keadaan darurat bandara jelang KTT G20 Bali  https://t.co/2LIoEWMYKE
2022-09-30 08:26:17,garuda080,"Diselenggarakannya KTT G20 di Bali, memberikan dampak positif pada perekonomian nasional, meningkatkan ekonomi masyarakat lokal. Hotel salah satunya yg akan mendapat dampak positif karena akan ditempati para perwakilan delegasi.  https://t.co/pXs6R1CfTi"
2022-09-30 08:18:29,mediaindonesia,"Jelang KTT G20, Kementan Perkuat Pengendalian Rabies di Bali   https://t.co/4NaXp7mhhW"
2022-09-30 08:06:03,jurnascom,Kementan Kendalikan Rabies di Bali Jelang KTT G20  https://t.co/XFOJmOhWDs
2022-10-05 12:21:14,jeslintuse2,Nusa Tenggara Timur Pemerintah Pastikan Semua Hotel Di Bali Siap Sambut KTT G20. #G20Indonesia #RecoverTogetherRecoverStronger #G20Indonesia2022 #GroupOfTwentyIndonesia  https://t.co/QAtdfL7sF0
2022-10-05 12:17:55,usharanimuni,Pemerintah pastikan hotel di Bali siap sambut KTT G20. Kepulauan Bangka Belitung  #G20Indonesia #RecoverTogetherRecoverStronger #G20Indonesia2022 #GroupOfTwentyIndonesia  https://t.co/siBpv8qWX5
2022-10-05 12:13:03,diaharmayanti1,Pemerintah pastikan hotel di bali siap sambut KTT G20  #G20Indonesia #RecoverTogetherRecoverStronger #G20Indonesia2022 #GroupOfTwentyIndonesia  https://t.co/QqFJhiMYOn
2022-10-05 12:12:31,SeptianiMestika,Bali Compendium akan dibawa Indonesia ke KTT G20 pada November mendatang sebagai salah satu deliverable di Presidensi G20 Indonesia - Arsjad Rasjid #b20 #arsjadrasjid #kompendiumbali #inklusifkolaboratif
2022-10-05 12:11:59,diaharmayanti1,Kesiapan jaringan telekomunikasi indonesia menghadapi KTT G20 Bali  #G20Indonesia #RecoverTogetherRecoverStronger #G20Indonesia2022 #GroupOfTwentyIndonesia  https://t.co/NDLwhQfXLA
2022-10-05 12:09:17,NovitaZara1,Bali Compendium akan dibawa Indonesia ke KTT G20 pada November mendatang sebagai salah satu deliverable di Presidensi G20 Indonesia - Arsjad Rasjid #b20 #arsjadrasjid #kompendiumbali #inklusifkolaboratif
2022-10-05 12:06:58,plat_mirah,"Mantap, pemerintah pastikan semua hotel di Bali siap menyambut delegasi KTT G20  🤗🤗🇲🇨🇲🇨 Kepulauan Bangka Belitung  #G20Indonesia #RecoverTogetherRecoverStronger #G20Indonesia2022 #GroupOfTwentyIndonesia  https://t.co/qOq2OwGpC6"
2022-10-05 12:02:57,verryprimatama1,Hotel di Bali siap Sambut KTT G20 !! #G20Indonesia #RecoverTogetherRecoverStronger #G20Indonesia2022 #GroupOfTwentyIndonesia Jawa Barat  https://t.co/BUAMyYTmOk
2022-10-05 12:02:16,CryptoKuta,"Menkominfo Johnny G. Plate : Kemkominfo telah menyiapkan Media Center KTT G20 dengan kapasitas untuk 1.500 orang.  “Media Center berlokasi di BICC,Hotel Westin,Nusa Dua Bali dan akan beroperasi mulai tanggal 13-17 November 2022”  @PlateJohnny @jokowi    https://t.co/IQ3apm7tH4"
2022-10-05 12:00:00,sadidawoaini,Pemerintah melalui Menparekraf Sandiaga Uno memastikan hotel di Bali siap untuk menyambut KTT G20  #G20Indonesia #RecoverTogetherRecoverStronger #G20Indonesia2022 #GroupOfTwentyIndonesia  https://t.co/QYEZ8J28Zi
2022-10-05 11:58:44,KekeCook2,Kesiapan jaringan telekomunikasi Indonesia menghadapi KTT G20 di Bali #G20Indonesia #RecoverTogetherRecoverStronger #G20Indonesia2022 #GroupOfTwentyIndonesia Jawa Barat  https://t.co/wQgxTtFt4u
2022-10-05 11:58:21,ErinNelson011,Menteri pariwisata dan ekonomi kreatif Sandiaga Uni memastikan persiapan hotel-hotel di Bali jelang puncak KTT G20 sudah sesuai jalur #G20Indonesia #RecoverTogetherRecoverStronger #G20Indonesia2022 #GroupOfTwentyIndonesia Jawa Barat  https://t.co/gDacZVubz0
2022-10-05 11:51:04,wiggins_eko,Pemerintah pastikan hotel di bali siap sambtu KTT G20 #G20Indonesia #RecoverTogetherRecoverStronger #G20Indonesia2022 #GroupOfTwentyIndonesia Jawa Barat  https://t.co/qREtQ81JeR
2022-10-05 11:50:28,DanangBarrera,Kesiapan jaringan telekomunikasi Indonesia menghadapi KTT G20 BALI   #G20Indonesia #RecoverTogetherRecoverStronger #G20Indonesia2022 #GroupOfTwentyIndonesia Jawa Barat  https://t.co/nh4PMMtjNm
2022-10-05 11:50:12,friska_diane,Pemerintah pstikan hotel di Bali sip sambut KTT G20  Daerah Istimewa Yogyakarta G20 Yogyakarta #G20Indonesia #RecoverTogetherRecoverStronger #G20Indonesia2022 #GroupOfTwentyIndonesia  https://t.co/tWnUhkWjJ7
2022-10-05 11:50:09,friska_diane,Kesiapan jaringan telekomunikasi Indonesia menghadapi KTT G20 Bali  Daerah Istimewa Yogyakarta G20 Yogyakarta #G20Indonesia #RecoverTogetherRecoverStronger #G20Indonesia2022 #GroupOfTwentyIndonesia  https://t.co/zatoRlXNwC
2022-10-05 11:44:31,Zyanpatra,"Perintah Luhut Pandjaitan di Bali Tegas, Ajak Pengemudi Lokal Terlibat di KTT G20  https://t.co/yahCLPkjee"
2022-10-05 11:41:58,Tahede55,Pemerintah pastikan Hotel di Bali siap sambuy KTT G20  INDONESIA SIAP JADI TUAN RUMAH G20  #G20Indonesia #RecoverTogetherRecoverStronger #G20Indonesia2022 Gorontalo  #GroupOfTwentyIndonesia  https://t.co/7Rh1L8aAh4
2022-10-05 11:40:05,jpnncom,"Perintah Menko Marves Luhut Pandjaitan di Bali tegas, ajak pengemudi lokal ikut memberi manfaatkan dengan terlibat di KTT G20 #LuhutPandjaitan  https://t.co/VotvtXpzWB"
2022-10-05 11:28:40,febipondo,Pemerintah Pastikan Hotel di Bali Siap Sambut KTT G20.   Nusa Tenggara Timur #G20Indonesia #RecoverTogetherRecoverStronger #G20Indonesia2022 #GroupOfTwentyIndonesia  https://t.co/IlQAk8kQYv
2022-10-05 11:21:56,amin_richmen,Berita Aceh - Jaringan telekomunikasi akan disiapkan untuk sambut KTT G20 di Bali  #G20Indonesia #RecoverTogetherRecoverStronger #G20Indonesia2022 #GroupOfTwentyIndonesia
2022-10-05 11:17:05,pak_jayaa,Update Aceh - Jaringan telekomunikasi akan disiapkan untuk sambut KTT G20 di Bali  #G20Indonesia #RecoverTogetherRecoverStronger #G20Indonesia2022 #GroupOfTwentyIndonesia  https://t.co/U1d6XzBxdY
2022-10-05 11:09:15,kurniayy,"Persiapan KTT G20, Menko Luhut Minta Sekolah dan Kantor di Bali WFH  https://t.co/OfIoFfascI  https://t.co/G2nsfBtqtk"
2022-10-05 11:00:01,WartaEkonomi,Menko Luhut Tinjau Venue Gelaran KTT G20 di Bali  https://t.co/ypWSJoJ9Bk
2022-10-05 10:59:11,faktualid_com,"Sandiaga Uno, Persiapan Bali Sambut 50.000 Delegasi dan Tamu KTT G20 Hampir Capai Titik Kulminasi #sandiagauno #G20Indonesia  https://t.co/io19yyMbd8"
2022-10-05 10:58:48,anastasyameira1,Kesiapan jaringan telekomunikasi Indonesia menghadapi KTT G20 Bali kami siap mendukung Nusa Tenggara Barat  #G20Indonesia #RecoverTogetherRecoverStronger #G20Indonesia2022 #GroupOfTwentyIndonesia  https://t.co/6X892yEhKc
2022-10-05 10:58:07,anastasyameira1,"Pemerintah pastikan hotel di Bali siap sambut KTT G20, Nusa Tenggara Barat  #G20Indonesia #RecoverTogetherRecoverStronger #G20Indonesia2022 #GroupOfTwentyIndonesia  https://t.co/OQla0R4C0y"
2022-10-05 10:56:52,voidotid,Kepala BNPB Letjen TNI Suharyanto memastikan kesiapan dalam menghadapi potensi bencana saat KTT G20 di Bali.  https://t.co/4nKlBDvsIf
2022-10-05 10:47:15,detikTravel,"Persiapan KTT G20, Menko Luhut Minta Sekolah dan Kantor di Bali WFH  https://t.co/8EnMGLTXa2"
2022-10-05 10:39:54,InfoPublikIP,"Menjelang Konferensi Tingkat Tinggi (KTT) G20 yang akan berlangsung di Bali pada 15 November 2022 mendatang, @kemkominfo terus meningkatkan kualitas jaringan telekomunikasi di lokasi acara. https://t.co/KQdcZj8ftv"
2022-10-05 10:38:06,InfoPublikIP,"Kunjungan ke Bali, Menko Marves Tinjau Venue KTT G20 Indonesia  https://t.co/n27GSj9IKb"
2022-10-05 10:27:16,nawacitadotco,Menkominfo: 1.337 Jurnalis Telah Mendaftar untuk Meliput KTT G20 di Bali  https://t.co/D2uUle5fZ7
2022-10-05 10:27:14,nawacitamedia,Menkominfo: 1.337 Jurnalis Telah Mendaftar untuk Meliput KTT G20 di Bali  https://t.co/FB1SBXJKHX
2022-10-05 10:27:11,NAWACIT4,Menkominfo: 1.337 Jurnalis Telah Mendaftar untuk Meliput KTT G20 di Bali  https://t.co/qqZBnwj4jX
2022-10-05 10:25:41,CEOfficialID,Luhut Perintahkan Sekolah dan Perkantoran di Bali Terapkan WFH Selama KTT G20  https://t.co/LnffqEOPJZ
2022-10-05 10:14:20,mwlorg_id,"Pertemuan tersebut menyaksikan pemilihan #LigaMuslimDunia untuk berpartisipasi dalam KTT Agama R20 yang pertama kalinya menjadi kelompok kerja partisipatif pada KTT G20, pada 2 &amp; 3 November di Bali, Indonesia, dengan partisipasi para pemimpin dalam dialog keagamaan &amp; intelektual.  https://t.co/0z5JCy1AfN"
2022-10-05 10:06:00,Salshab65173582,Pemerintah terus mematangkan persiapan rangkaian puncak acara KTT G20 yang dijadwalkan di Bali pada 15-16 November 2022.s #IndonesiaBergerakPulih TNI ADALAH KITA #MariBerinvestasidiIndonesia Dirgahayu TNI Army  https://t.co/Mp8PZ6tRJl
2022-10-05 09:40:40,jokowipejuangID,Pemerintah pastikan semua Hotel di Bali siap sambut KTT G20. Mulai dari hotel-hotel yang tersebar di Nusa Dua dan beberapa wilayah lainnya juga sudah siap menyambut KTT G20. Dan siap menyukseskan KTT G20.  Mandala Krida Jepang Kengerian di Pintu 13 #JokowiPresidenku #JokowiHebat  https://t.co/wz8cRaM8gn
2022-10-05 09:38:32,tempodotco,Menko Luhut Binsar Pandjaitan menugaskan Pemprov Bali untuk mengurangi mobilisasi masyarakat selama KTT G20. #TempoBisnis  https://t.co/VcW6IiDiUH
2022-10-05 09:35:42,GNurhazrati,Indonesia selaku pemegang Presidensi G20 terus memantau perkembangan global termasuk situasi geopolitik jelang pelaksanaan KTT G20 yang akan digelar di Bali pada bulan November mendatang.  #onepiece1062  #cancer  5 Oktober  BTS ARMY  Gryffindor  Telkomsel  Run BTS  https://t.co/dJScwaAibV
2022-10-05 09:35:21,IdJurnalis,66 SPKLU Khusus Disiapkan untuk Sambut Delegasi KTT G20 di Bali  https://t.co/xmWyuAQZR7
2022-10-05 09:26:41,BumnPsrJitu,"Sobat BUMN, Green Energy Station (GES) @Pertamina siap melayani para delegasi KTT G20 di Bali pada November 2022 untuk kebutuhan  kegiatan G20 yang sebagian besar menggunakan kendaraan listrik ramah lingkungan.  #EnergizingYou #GESPertaminaDukungG20 #PertaminaPimpinTransisiEnergi  https://t.co/Udddf6HaDC"
2022-10-05 09:23:26,kalanganiseng,#G20INDONESIA Pemerintah Gunakan Mobil Listrik Untuk KTT G20 Bali  https://t.co/SSX8xqlie9 lewat @YouTube
2022-10-05 09:21:00,IDNdihatiku,Pemerintah pastikan semua Hotel di Bali siap sambut KTT G20. Mulai dari hotel-hotel yang tersebar di Nusa Dua dan beberapa wilayah lainnya juga sudah siap menyambut KTT G20. Dan siap menyukseskan KTT G20.  Mandala Krida Jepang Kengerian di Pintu 13 #JokowiPresidenku #JokowiHebat  https://t.co/CKWl7duIr9
2022-10-05 09:20:00,rakyatkuatt,Pemerintah pastikan semua Hotel di Bali siap sambut KTT G20. Mulai dari hotel-hotel yang tersebar di Nusa Dua dan beberapa wilayah lainnya juga sudah siap menyambut KTT G20. Dan siap menyukseskan KTT G20.  Mandala Krida Jepang Kengerian di Pintu 13 #JokowiPresidenku #JokowiHebat  https://t.co/fQatn9pmzA
2022-10-05 09:13:48,BUMN_SLWS_TEPAT,Green Energy Station (GES) @Pertamina siap melayani para delegasi KTT G20 di Bali pada November 2022 untuk kebutuhan kendaraan kegiatan G20 yang sebagian besar menggunakan kendaraan listrik ramah lingkungan. #EnergizingYou #GESPertaminaDukungG20 #PertaminaPimpinTransisiEnergi  https://t.co/8eZF9dvOCu
2022-10-05 09:08:11,WendyTangmar,"@CNNIndonesia Tragedi tambahan bagi negara ini, betapa primitifnya kita kalo seluruh dunia tau, sedangkan kita masih disuguhkan sinetron 42botol minuman.  Negara ketua G20 loh ini, mau taro di mana mukanya Pak @jokowi kalo di KTT Bali ditanyain kepala negara lain rame2...?"
2022-10-05 09:07:04,antarabiz,"Tinjau persiapan KTT G20 di Bali, Luhut: Sudah paten  https://t.co/DB2ic1wlpT"
2022-10-05 09:06:09,BUMN_Manado_Ayo,Pertamina siap layani delegasi KTT G20 di Bali pada November 2022 untuk kebutuhan kendaraan listrik di kegiatan G20. #GESPertaminaDukungG20  https://t.co/cC6syxrifm
2022-10-05 08:56:57,FaGtng,Telkomsel sudah menyiapkan kecepatan unduh 4G di beberapa wilayah di Bali mencapai 100 Mbps atau sekitar 4 kali lipat lebih cepat dari kecepatan unduh rata-rata nasional.  Semua bekerja untuk sukseskan acara puncak KTT G20.  @kemkominfo  @PlateJohnny  https://t.co/T3avZUYIHV
2022-10-05 08:52:20,Faktorutama,"Sandiaga Uno, Persiapan Bali Sambut 50.000 Delegasi dan Tamu KTT G20 Hampir Capai Titik Kulminasi -  https://t.co/oUxucXFGr8"
2022-10-05 08:42:13,antaranews,"Menteri Koordinator Bidang Kemaritiman dan Investasi Luhut Binsar Pandjaitan menilai persiapan KTT G20 Indonesia di Bali pada November 2022, mengalami kemajuan yang baik.   https://t.co/RkBnmj36lu"
2022-10-05 08:17:28,Gajah_Mada01,"Untuk mendukung pelaksanaan KTT G20 di Bali, Kominfo mendukung infrastruktur telekomunikasi melalui peningkatan kecepatan internet seluler 4G, fasilitasi perluasan jaringan 5G, penataan kabel udara, dan penyiapan jaringan backup @PlateJohnny  @kemkominfo   https://t.co/y94B0tOdnC"
2022-10-05 08:00:47,PtBerita,Menparekraf Pastikan Kesiapan Akomodasi Delegasi KTT G20 -  https://t.co/zUh8z5R1F9  https://t.co/JdresMa87g
2022-10-05 07:51:03,wahananewsdotco,"BMKG Pasang Layar Cuaca Antisipasi Gempa Menjelang KTT G20, Ini Lokasinya  https://t.co/GkJAYNEZIQ #Bali #KttG20 #Ktt #KttG20DiBali"
2022-10-05 07:29:48,sandiuno,"Dalam kunjungan kerja kemarin di Bali, kami @kemenparekraf mengadakan Rapat Koordinasi bersama @kemenkomarves mematangkan dan mempersiapkan secara teknis pelaksanaan Spouse Program KTT G20 pda 15-16 November 2022 yang dirancang khusus untuk 24 delegasi tingkat Kepala Negara.  https://t.co/FlIVjzQJcA"
2022-10-05 07:25:22,Marbot_Udien,"Kemenkominfo menyiapkan Media Center yang mampu menampung hingga 1.500 jurnalis peliput Konferensi Tingkat Tinggi (KTT) G20 di kawasan Bali International Convention Center (BICC), Nusa Dua, Provinsi Bali, pada 15-16 November 2022 mendatang. @PlateJohnny @kemkominfo"
2022-10-05 07:06:15,NoviRoose,Pemerintah Indoensia terus matangkan persiapan KTT G20 di Bali. #EkonomiRITetapMenguat  ..  https://t.co/fhRGoGtjbg
2022-10-05 07:05:58,nvroost,Pemerintah Indoensia terus matangkan persiapan KTT G20 di Bali. #EkonomiRITetapMenguat  https://t.co/S9eY4wolHZ
2022-10-05 06:51:09,tempodotco,Sandiaga Siapkan 23 Hotel untuk Delegasi KTT G20 di Bali  https://t.co/iOj3MxZjjR #TempoBisnis
2022-10-05 06:48:58,Cah_Beler,"@hyang_wisnu @PlateJohnny @kemkominfo Untuk mendukung keberhasilan pelaksanaan KTT G20 di Bali, Kemenkominfo mendukung infrastruktur telekomunikasi melalui peningkatan kecepatan internet seluler 4G, memfasilitasi perluasan jaringan 5G, penataan kabel udara, serta penyiapan jaringan cadangan. @PlateJohnny @kemkominfo"
2022-10-05 06:44:04,Cah_Beler,"Menkominfo menyatakan telah menyiapkan Media Center KTT G20 dengan kapasitas untuk 1.500 orang. Media Center berlokasi di Bali International Convention Center (BICC), Hotel Westin, Nusa Dua Bali dan akan beroperasi mulai tanggal 13-17 November 2022. @PlateJohnny @kemkominfo"
2022-10-05 06:28:43,goseolcom,"Jelang KTT G20, Dicek Kesiapan Bandara di Bali  https://t.co/6xkc1of1Vl"
2022-10-05 06:27:16,kompascom,Menko Marves Luhut Binsar Pandjaitan memantau persiapan jelang KTT G20 Bali pada November 2022.  https://t.co/lpGLt8u2dA
2022-10-05 06:18:01,KompasEkonomi,Luhut: Persiapan KTT G20 Bali Sudah Paten  https://t.co/Kz7F0UZ1gR
2022-10-05 06:00:33,nyeknih,Pemerintah Indonesia terus matangkan persiapan untuk KTT G20 di Bali agar berjalan dengan lancar #EkonomiRITetapMenguat #MariBerinvestadidiIndonesia  https://t.co/6t62eiplUl
2022-10-05 06:00:19,Marquetalove,Jokowi akan terus mematangkan persiapan rangkaian puncak acara konferensi KTT G20 di bali    #EkonomiRITetapMenguat  https://t.co/91iR1ZeNUy
2022-10-05 06:00:02,_inibiann,Mematangkan dalam persiapan rangkaian puncak acara KTT G20 yang akan di jadwalkan di Bali pada 15 - 16 November 2022 mendatang. #EkonomiRITetapMenguat #MariBerinvestadidiIndonesia  https://t.co/9gAtC5HybB
2022-10-05 06:00:01,Ekspektasi6,Pemerintah Indonesia mematangkan persiapan rangkaian puncak acara KTT G20 di Bali pada 15-16 November 2022 #EkonomiRITetapMenguat #DukungKUHP  https://t.co/1AcVJUe9No
2022-10-05 06:00:01,fataqi_z,"Menjelang acara KTT G20 di Bali , persiapan demi persiapan terus dilakukan secara tegas  #EkonomiRITetapMenguat  #SukseskanPambangunanIKN  https://t.co/z4aCr8gluB"
2022-10-05 06:00:00,zahro1945,Pemerintah Indonesia Fokus untuk persiapan acara KTT G20 di Bali.  #EkonomiRITetapMenguat #MariBerinvestadidiIndonesia  https://t.co/77xmuDGJuh
2022-10-05 06:00:00,KamidiaD,Pemerintah Indonesia terus mematangkan persiapan rangkaian puncak acara Konferensi Tingkat Tinggi (KTT) G20 yang dijadwalkan berlangsung di Bali pada 15-16 November 2022   #EkonomiRITetapMenguat #DukungKUHP  https://t.co/p8JGoX8MX6
2022-10-05 05:11:37,ZilaAr_,"Untuk mendukung keberhasilan pelaksanaan KTT G20 di Bali, Kominfo mendukung infrastruktur telekomunikasi melalui peningkatan kecepatan internet seluler 4G, memfasilitasi perluasan jaringan 5G. @kemkominfo @PlateJohnny   https://t.co/MTQDtRr2cb"
2022-10-05 04:42:08,BUMNMamujuJitu,Green Energy Station (GES) @Pertamina siap melayani para delegasi KTT G20 di Bali pada November 2022 untuk kebutuhan kendaraan kegiatan G20 yang sebagian besar menggunakan kendaraan listrik ramah lingkungan. #EnergizingYou #GESPertaminaDukungG20 #PertaminaPimpinTransisiEnergi  https://t.co/R37Q4sYZDw
2022-10-05 04:37:52,AryPrasetyo_85,"Untuk mendukung kesuksesan pelaksanaan KTT G20 di Bali, @kemkominfo mendukung infrastruktur telekomunikasi melalui peningkatan kecepatan internet seluler 4G,fasilitasi perluasan jaringan 5G,penataan kabel udara,serta penyiapan jaringan backup. @PlateJohnny  https://t.co/9FYWGyjveU"
2022-10-05 04:11:04,21BeritaTerkini,"Jelang KTT G20, Luhut Cek Kesiapan Layanan Bandara di Bali  https://t.co/oODJCGs3KJ"
2022-10-05 03:39:32,Bisniscom,"Jelang KTT G20, Luhut Cek Kesiapan Layanan Bandara di Bali  https://t.co/LqVIKoFNEL"
2022-10-05 00:51:00,SINDOnews,"Dukung Konektivitas dalam Penyelenggaraan KTT G20 di Bali, PT Telkom Lakukan 4 Hal Ini   #Sindonews #BukanBeritaBiasa . https://t.co/WoThNFRHI6"
2022-10-05 00:39:35,bumnpwtjitu,"Sobat BUMN, Green Energy Station (GES) @Pertamina siap melayani para delegasi KTT G20 di Bali pada November 2022 untuk kebutuhan kendaraan kegiatan G20   #EnergizingYou #GESPertaminaDukungG20 #PertaminaPimpinTransisiEnergi  https://t.co/rWNi7Ysvqa"
2022-10-04 23:49:37,kihutimes,"Kepala Badan Nasional Penanggulangan Bencana (BNPB) Letjen TNI Suharyanto, menghadiri rapat tingkat menteri membahas Penyelenggaraan Konferensi Tingkat Tinggi (KTT) G20, yang digelar di Badung, Bali pada Selasa (4/10).    https://t.co/bOb6ivL256"
2022-10-04 22:40:30,CEOfficialID,"Dukung Konektivitas dalam Penyelenggaraan KTT G20 di Bali, PT Telkom Lakukan 4 Hal Ini  https://t.co/VbUiA3AErn"
2022-10-04 22:24:42,klikwarta_com,"Jelang KTT G20, Kepala BNPB Tegaskan Kesiapan Hadapi Potensi Bencana di Bali  https://t.co/oJurtcNqWB"
2022-10-04 22:23:26,detikfinance,PLN nyatakan sebanyak 66 SPKLU siap untuk mengisi kendaraan listrik yang akan digunakan dalam acara puncak KTT G20 di Bali bulan depan.  https://t.co/9rxCQw4zTd
2022-10-04 22:07:44,detikcom,"KTT G20 akan membuat Bali ramai oleh delegasi. Lalu, apakah ada rekomendasi untuk wisatawan yang akan datang ke Bali di tanggal-tanggal pelaksanaan G20?  https://t.co/rhPDbT8KM4"
2022-10-04 22:06:19,beritasulselcom,PT Telkom Pastikan Kelancaran Jaringan Telekomunikasi KTT G20 di Bali -  https://t.co/VRHim8tNNO  https://t.co/EvzY0hnpuT
2022-10-04 22:02:29,bumnpdgjitu,"Sobat BUMN, Green Energy Station (GES) @Pertamina siap melayani para delegasi KTT G20 di Bali pada November 2022 untuk kebutuhan kendaraan kegiatan G20 yang sebagian besar  #EnergizingYou #GESPertaminaDukungG20 #PertaminaPimpinTransisiEnergi  https://t.co/4dVCG4pPdo"
2022-10-04 22:00:25,bumnbogorjitu,"Sobat BUMN, Green Energy Station (GES) @Pertamina siap melayani para delegasi KTT G20 di Bali pada November 2022.  #EnergizingYou #GESPertaminaDukungG20 #PertaminaPimpinTransisiEnergi  https://t.co/klQkUMlyCV"
2022-10-04 21:54:14,Zyanpatra,"BMKG Pasang Layar Cuaca Antisipasi Gempa Menjelang KTT G20 di Bali, Catat Lokasinya  https://t.co/70kKI1dDYm"
2022-10-04 21:45:04,jpnncom,"BMKG segera memasang layar cuaca mengantisipasi gempa, tsunami dan bencana alam menjelang KTT G20 di Bali, catat lokasinya  #BMKG  https://t.co/IPwJ2xXcSn"
2022-10-04 20:16:57,jpnncom,"#BeritaBali  Jokowi Cek 3 Venue KTT G20, Polda Bali Siaga Penuh @jokowi  #presidenjokowi  #venueKTTG20  #poldabali   https://t.co/SThYbypg6S"
2022-10-04 20:12:12,MarlitaLolita,sangat sangat bangga pastinya KTT G20 di Bali sukses dan aman #G20Indonesia #RecoverTogetherRecoverStronger #G20Indonesia2022 #GroupOfTwentyIndonesia Banten  https://t.co/5oAOhGbSlK
2022-10-04 20:11:09,DamaiSulbar,Makna Jihad itu luas.  #Indonesia #Bali #KTT #G20 #Damai #LawanTerorisme #TangkalRadikalisme #Merdeka #PancasilaDasarNegara #NkriHargaMati #Malaqbi #MelleteDiatonganang #Manakarra #SulbarInfo #SulbarModerat #PolewaliMandar #Majene #Mamuju #MamujuTengah #Mamasa #Pasangkayu #Topoyo  https://t.co/X6VrcTuhgG
2022-10-04 20:10:42,DamaiSulbar,Tindak tegas pemecah belah NKRI  #Indonesia #Bali #KTT #G20 #Damai #LawanTerorisme #TangkalRadikalisme #Merdeka #PancasilaDasarNegara #NkriHargaMati #Malaqbi #MelleteDiatonganang #Manakarra #SulbarInfo #SulbarModerat #PolewaliMandar #Majene #Mamuju #MamujuTengah #Mamasa  https://t.co/fNbfSAisNw
2022-10-04 20:09:11,DamaiSulbar,Rasa cinta Rasulullah terhadap negerinya  #Indonesia #Bali #KTT #G20 #Damai #LawanTerorisme #TangkalRadikalisme #Merdeka #PancasilaDasarNegara #NkriHargaMati #Malaqbi #MelleteDiatonganang #Manakarra #SulbarInfo #SulbarModerat #PolewaliMandar #Majene #Mamuju #MamujuTengah #Mamasa  https://t.co/KUEi8taj7u
2022-10-04 20:07:49,DamaiSulbar,Jihat jangan diartikan sempit.  #Indonesia #Bali #KTT #G20 #Damai #LawanTerorisme #TangkalRadikalisme #Merdeka #PancasilaDasarNegara #NkriHargaMati #Malaqbi #MelleteDiatonganang #Manakarra #SulbarInfo #SulbarModerat #PolewaliMandar #Majene #Mamuju #MamujuTengah #Mamasa  https://t.co/oGG38nroGG
2022-10-04 20:07:10,kurniayy,"KTT G20 Bikin Bali Ramai, Turis Umum Disarankan Nginap di Hotel-hotel Ini  https://t.co/x5SLOHIdfR  https://t.co/oUS3JSGBGc"
2022-10-04 20:07:05,DamaiSulbar,#Indonesia #Bali #KTT #G20 #Damai #LawanTerorisme #TangkalRadikalisme #Merdeka #PancasilaDasarNegara #NkriHargaMati #Malaqbi #MelleteDiatonganang #Manakarra #SulbarInfo #SulbarModerat #PolewaliMandar #Majene #Mamuju #MamujuTengah #Mamasa #Pasangkayu #Topoyo  https://t.co/OzWPSiLQ6z
2022-10-04 20:06:30,DamaiSulbar,Tidak ada alasan mempersoalkan pancasila sebagai dasar berbangsa dan bernegara.  #Indonesia #Bali #KTT #G20 #Damai #LawanTerorisme #TangkalRadikalisme #Merdeka #PancasilaDasarNegara #NkriHargaMati #Malaqbi #MelleteDiatonganang #Manakarra #SulbarInfo #SulbarModerat #PolewaliMandar  https://t.co/AcOqDwkk5x
2022-10-04 20:05:48,DamaiSulbar,"Kita harus terus membangun nilai persatuan, toleransi dan keberagaman.  #Indonesia #Bali #KTT #G20 #Damai #LawanTerorisme #TangkalRadikalisme #Merdeka #PancasilaDasarNegara #NkriHargaMati #Malaqbi #MelleteDiatonganang #Manakarra #SulbarInfo #SulbarModerat #PolewaliMandar #Majene  https://t.co/XMZrCQr3Na"
2022-10-04 20:03:00,newsmerahputih,Telkom siapkan infrastruktur jaringan telekomunikasi Konefersi Tingkat Tinggi (KTT) G20 di Bali.  #merahputihcom #Bali #Telkom #Teknologi #Teknologibaru   https://t.co/MxKMv1gRtC
2022-10-04 19:59:16,fathannibos,Indonesia dengan kekayaan budaya nya harus sering ditonjolkan di G20 nanti  KTT G20 di Bali sukses dan aman #G20Indonesia #RecoverTogetherRecoverStronger #G20Indonesia2022 #GroupOfTwentyIndonesia  https://t.co/HDsv7gjkxx
2022-10-04 19:58:47,fathannibos,kerenn masyarakat belitung antusias menyambut G20  KTT G20 di Bali sukses dan aman #G20Indonesia #RecoverTogetherRecoverStronger #G20Indonesia2022 #GroupOfTwentyIndonesia  https://t.co/Z1uaB4J29Y
2022-10-04 19:58:24,fathannibos,"enakk nii, banyak keuntungan untuk Indonesia  KTT G20 di Bali sukses dan aman #G20Indonesia #RecoverTogetherRecoverStronger #G20Indonesia2022 #GroupOfTwentyIndonesia  https://t.co/cgLLqHd1GZ"
2022-10-04 19:58:02,fathannibos,"asli sih, makin terkenal nnti Indonesia di mata dunia  KTT G20 di Bali sukses dan aman #G20Indonesia #RecoverTogetherRecoverStronger #G20Indonesia2022 #GroupOfTwentyIndonesia  https://t.co/Ge5rwmqK0r"
2022-10-04 19:57:44,fathannibos,sangat sangat bangga pastinya  KTT G20 di Bali sukses dan aman #G20Indonesia #RecoverTogetherRecoverStronger #G20Indonesia2022 #GroupOfTwentyIndonesia  https://t.co/bmBpmUX5RY
2022-10-04 19:56:30,DEWITOGEL1,Polda Bali ajak masyarakat jaga kamtibmas jelang KTT G20  https://t.co/M2UbGwuHDe
2022-10-04 19:50:58,chatnews_id,Indonesia menyiapkan puncak acara Konferensi Tingkat Tinggi (KTT) negara-negara #G20 di #Bali.   https://t.co/s6wEQv8bJt
2022-10-04 19:27:55,bocorantogelHK,Polda Bali ajak masyarakat jaga kamtibmas jelang KTT G20  https://t.co/ZvM2QrgEfB
2022-10-04 19:13:32,Kemhan_RI,"Mulai dari kesiapan Bandara Ngurah Rai untuk melayani penerbangan, kesiapan akomodasi perhotelan sebagai tempat menginap delegasi, hingga menyediakan unit transportasi listrik dgn mempopulerkan green energy atau energi terbarukan.  #Kemhan #KemhanRI #G20Indonesia2022 #KTTG20Bali"
2022-10-04 18:47:58,ArdinMark,Ayo Dukung penuh KTT G20 Bali   Suara Bali #G20Indonesia #RecoverTogetherRecoverStronger #G20Indonesia2022 #GroupOfTwentyIndonesia  https://t.co/VVAII6L7Nu
2022-10-04 18:45:16,detikTravel,"KTT G20 Bikin Bali Ramai, Turis Umum Disarankan Nginap di Hotel-hotel Ini  https://t.co/QnbJi5eqV8"
2022-10-04 18:42:40,KemensetnegRI,"5. Untuk memastikan kesiapan Bali sebagai tuan rumah, Presiden @jokowi akan meninjau lokasi pelaksanaan pertemuan G20. Presiden juga memastikan detail agenda pertemuan karena agenda KTT G20 berdekatan waktunya dengan pertemuan internasional lainnya yaitu KTT ASEAN &amp; APEC.  https://t.co/N1D0oBKVun"
